B3: Monthly Actual Data
A4: Month | B4: 1995 | C4: 1996 | D4: 1997 | E4: 1998 | F4: 1999 | G4: 2000 | H4: 2001 | I4: 2002 | K4: Date | L4: End of Period Inventory | M4: 5-year High (1997-2001) | N4: 5-year Low (1997-2001)
A5: January | B5: 2045 | C5: 1462.468304 | D5: 1495.563116 | E5: 1712 | F5: 2094 | G5: 1724.6516630000001 | H5: 1265.496386 | I5: 2377 | K5: 36644 | L5: 1182.2819617157197 | M5: 1457 | N5: 947
A6: February | B6: 1542 | C6: 1020.58242 | D6: 1139.4220359999999 | E6: 1426 | F6: 1792 | G6: 1300.4144570000001 | H6: 912.36575100000005 | K6: 36651 | L6: 1242.1016072405325 | M6: 1495 | N6: 1054
A7: March | B7: 1332 | C7: 757.994642 | D7: 990.43301299999996 | E7: 1183 | F7: 1430 | G7: 1149.9492420000001 | H7: 741.55100800000002 | K7: 36658 | L7: 1283.3381464616693 | M7: 1571 | N7: 1133
A8: April | B8: 1379 | C8: 853.96110799999997 | D8: 1051.234753 | E8: 1386 | F8: 1514 | G8: 1184.3404459999999 | H8: 992.2634250000001 | K8: 36665 | L8: 1333.1917873125392 | M8: 1651 | N8: 1191
A9: May | B9: 1668 | C9: 1161.114546 | D9: 1364.797456 | E9: 1774 | F9: 1847 | G9: 1426.4080000000001 | H9: 1440.095644 | K9: 36672 | L9: 1382.2871228127456 | M9: 1726 | N9: 1263
A10: June | B10: 2014 | C10: 1529.1247699999999 | D10: 1731.1334360000001 | E10: 2114 | F10: 2157 | G10: 1706.3 | H10: 1882.4311089999999 | K10: 36679 | L10: 1454.662611653534 | M10: 1796 | N10: 1353
A11: July | B11: 2301 | C11: 1897.649343 | D11: 2016.5366449999999 | E11: 2428 | F11: 2390 | G11: 1996 | H11: 2260.7627499999999 | K11: 36686 | L11: 1531.7861133607337 | M11: 1885 | N11: 1443
A12: August | B12: 2495 | C12: 2244.504117 | D12: 2337.911615 | E12: 2698 | F12: 2632 | G12: 2190 | H12: 2575.7977000000001 | K12: 36693 | L12: 1590.8080834742843 | M12: 1941 | N12: 1535
A13: September | B13: 2802 | C13: 2604.9810189999998 | D13: 2672.3088520000001 | E13: 2928 | F13: 2884 | G13: 2473 | H13: 2944.2665150000003 | K13: 36700 | L13: 1657.0144599807263 | M13: 2020 | N13: 1627
A14: October | B14: 2996 | C14: 2810.4756400000001 | D14: 2885.777419 | E14: 3191 | F14: 3026 | G14: 2699 | H14: 3144 | K14: 36707 | L14: 1717.3074310000002 | M14: 2106 | N14: 1694
A15: November | B15: 2728 | C15: 2549.1373570000001 | D15: 2698.8862260000001 | E15: 3155 | F15: 2991 | G15: 2443 | H15: 3204 | K15: 36714 | L15: 1811.8896233145554 | M15: 2169 | N15: 1785
A16: December | B16: 2153 | C16: 2172.5511759999999 | D16: 2174.5195359999998 | E16: 2730 | F16: 2509 | G16: 1720 | H16: 2903 | K16: 36721 | L16: 1875.0507055089688 | M16: 2231 | N16: 1869
K17: 36728 | L17: 1921.1158819068955 | M17: 2308 | N17: 1921
K18: 36735 | L18: 1977.9098901134453 | M18: 2366 | N18: 1976
K19: 36742 | L19: 2036.2821722123613 | M19: 2428 | N19: 2024
K20: 36749 | L20: 2080.1687634372515 | M20: 2499 | N20: 2080
K21: 36756 | L21: 2127.4593909337054 | M21: 2568 | N21: 2127
K22: 36763 | L22: 2171.3934078842285 | M22: 2634 | N22: 2171
K23: 36770 | L23: 2204.7092453817463 | M23: 2685 | N23: 2205
K24: 36777 | L24: 2273.8014614157673 | M24: 2721 | N24: 2274
K25: 36784 | L25: 2337.8976791612795 | M25: 2795 | N25: 2338
K26: 36791 | L26: 2412.1224422558848 | M26: 2857 | N26: 2412
K27: 36798 | L27: 2486.0323023605933 | M27: 2925 | N27: 2486
K28: 36805 | L28: 2546.9979049586304 | M28: 2998 | N28: 2547
K29: 36812 | L29: 2573.939137876785 | M29: 3068 | N29: 2574
K30: 36819 | L30: 2644.1056812399856 | M30: 3100 | N30: 2644
K31: 36826 | L31: 2712.7100239906504 | M31: 3132 | N31: 2713
K32: 36833 | L32: 2747.9669074896233 | M32: 3185 | N32: 2748
K33: 36840 | L33: 2743.9334784061662 | M33: 3213 | N33: 2744
K34: 36847 | L34: 2653.9428572851502 | M34: 3194 | N34: 2654
K35: 36854 | L35: 2506.3542640638616 | M35: 3211 | N35: 2506
K36: 36861 | L36: 2433.8265919322521 | M36: 3204 | N36: 2434
K37: 36868 | L37: 2287.1299875002883 | M37: 3199 | N37: 2287
K38: 36875 | L38: 2139.830231002396 | M38: 3168 | N38: 2140
K39: 36882 | L39: 1973.059597159538 | M39: 3099 | N39: 1973
K40: 36889 | L40: 1765.3378281515277 | M40: 2983 | N40: 1765
K41: 36896 | L41: 1611.1469148777642 | M41: 2707 | N41: 1611
K42: 36903 | L42: 1524.7705772454831 | M42: 2472 | N42: 1525
K43: 36910 | L43: 1452.2954504405711 | M43: 2265 | N43: 1452
K44: 36917 | L44: 1333.2925958758249 | M44: 2173 | N44: 1333
K45: 36924 | L45: 1238.0557847735865 | M45: 2099 | N45: 1238
K46: 36931 | L46: 1150.897765037859 | M46: 2017 | N46: 1151
K47: 36938 | L47: 1075.035452910045 | M47: 1976 | N47: 1075
K48: 36945 | L48: 966.02283848258992 | M48: 1888 | N48: 966
K49: 36952 | L49: 893.55067749392401 | M49: 1763 | N49: 894
K50: 36959 | L50: 817.43073505169104 | M50: 1689 | N50: 817
K51: 36966 | L51: 798.97578268666098 | M51: 1542 | N51: 799
K52: 36973 | L52: 795.63629818739014 | M52: 1446 | N52: 796
K53: 36980 | L53: 737.78450416083228 | M53: 1403 | N53: 738
K54: 36987 | L54: 741.06910747297934 | M54: 1407 | N54: 741
K55: 36994 | L55: 810.49714905028168 | M55: 1447 | N55: 810
K56: 37001 | L56: 844.20244312067359 | M56: 1452 | N56: 844
K57: 37008 | L57: 947.28467818162596 | M57: 1457 | N57: 947
K58: 37015 | L58: 1053.8431262177578 | M58: 1495 | N58: 1054
K59: 37022 | L59: 1156.5245563322928 | M59: 1571 | N59: 1133
K60: 37029 | L60: 1267.2905535510495 | M60: 1651 | N60: 1191
K61: 37036 | L61: 1353.9377347011502 | M61: 1726 | N61: 1263
K62: 37043 | L62: 1456.7649316640145 | M62: 1796 | N62: 1353
K63: 37050 | L63: 1560.4758235668185 | M63: 1885 | N63: 1443
K64: 37057 | L64: 1663.5235716116754 | M64: 1941 | N64: 1535
K65: 37064 | L65: 1767.929217290857 | M65: 2020 | N65: 1627
K66: 37071 | L66: 1867.4802769992762 | M66: 2106 | N66: 1694
K67: 37078 | L67: 1973.6422845090603 | M67: 2169 | N67: 1785
K68: 37085 | L68: 2074.9391264814963 | M68: 2231 | N68: 1869
K69: 37092 | L69: 2151.5597707526058 | M69: 2308 | N69: 1921
K70: 37099 | L70: 2220.0098621278294 | M70: 2366 | N70: 1976
K71: 37106 | L71: 2294.5996332685381 | M71: 2428 | N71: 2024
K72: 37113 | L72: 2340.710946570618 | M72: 2499 | N72: 2080
K73: 37120 | L73: 2426.2005576392621 | M73: 2568 | N73: 2127
K74: 37127 | L74: 2500.4200179664431 | M74: 2634 | N74: 2171
K75: 37134 | L75: 2575.7977000000001 | M75: 2685 | N75: 2205
K76: 37141 | L76: 2672.6613170270789 | M76: 2721 | N76: 2274
K77: 37148 | L77: 2764.268361979885 | M77: 2795 | N77: 2338
K78: 37155 | L78: 2857.356639414571 | M78: 2857 | N78: 2412
K79: 37162 | L79: 2924.9129328160302 | M79: 2925 | N79: 2486
K80: 37169 | L80: 2997.5284978576901 | M80: 2998 | N80: 2547
K81: 37176 | L81: 3067.7680954663069 | M81: 3068 | N81: 2574
K82: 37183 | L82: 3100.1630776446627 | M82: 3100 | N82: 2644
K83: 37190 | L83: 3131.7413977600281 | M83: 3132 | N83: 2713
K84: 37197 | L84: 3148.4875396343523 | M84: 3185 | N84: 2748
K85: 37204 | L85: 3172.2331173651282 | M85: 3213 | N85: 2744
K86: 37211 | L86: 3193.5652543489514 | M86: 3194 | N86: 2654
K87: 37218 | L87: 3211.493228397725 | M87: 3211 | N87: 2506
K88: 37225 | L88: 3204.0128050000003 | M88: 3204 | N88: 2434
K89: 37232 | L89: 3198.8691571780946 | M89: 3199 | N89: 2287
K90: 37239 | L90: 3167.5502820409324 | M90: 3168 | N90: 2140
K91: 37246 | L91: 3098.7437708637926 | M91: 3099 | N91: 1973
K92: 37253 | L92: 2983.4323184181467 | M92: 2983 | N92: 1765
K93: 37260 | L93: 2795.3093668373717 | M93: 2707 | N93: 1611
K94: 37267 | L94: 2662.1860240588244 | M94: 2472 | N94: 1525
K95: 37274 | L95: 2544.073623763969 | M95: 2265 | N95: 1452
K96: 37281 | L96: 2438.4702123468414 | M96: 2173 | N96: 1333
K97: 37288 | L97: 2363.7076318553868 | M97: 2099 | N97: 1238
K98: 37295 | L98: 2190.1927997529156 | M98: 2017 | N98: 1151
K99: 37302 | L99: 2064.3863224293186 | M99: 1976 | N99: 1075
K100: 37309 | L100: 1990.0721394314612 | M100: 1888 | N100: 966
K101: 37316 | L101: 1845.401725712687 | M101: 1763 | N101: 894
K102: 37323 | M102: 1689 | N102: 817
K103: 37330 | L103: 1580 | M103: 1542 | N103: 799
K104: 37337 | L104: 1510 | M104: 1446 | N104: 796
K105: 37344 | L105: 1446 | M105: 1403 | N105: 738
K106: 37351 | L106: 1442 | M106: 1407 | N106: 741
K107: 37358 | L107: 1457 | M107: 1447 | N107: 810
K108: 37365 | L108: 1524 | M108: 1452 | N108: 844
K109: 37372 | L109: 1555 | M109: 1457 | N109: 947
K110: 37379 | L110: 1594 | M110: 1495 | N110: 1054
K111: 37386 | L111: 1657 | M111: 1571 | N111: 1133
K112: 37393 | L112: 1725 | M112: 1651 | N112: 1191
K113: 37400 | L113: 1796 | M113: 1726 | N113: 1263
K114: 37407 | L114: 1893 | M114: 1796 | N114: 1353
K115: 37414 | L115: 2015 | M115: 1885 | N115: 1443
K116: 37421 | L116: 2096 | M116: 1941 | N116: 1535
K117: 37428 | L117: 2191 | M117: 2020 | N117: 1627
J118: revised | K118: 37435 | L118: 2286 | M118: 2106 | N118: 1694
K119: 37442 | L119: 2353 | M119: 2169 | N119: 1785
K120: 37449 | L120: 2422 | M120: 2231 | N120: 1869
K121: 37456 | L121: 2486 | M121: 2308 | N121: 1921
J122: revised | K122: 37463 | L122: 2534 | M122: 2366 | N122: 1976
K123: 37470 | L123: 2567 | M123: 2428 | N123: 2024
K124: 37477 | L124: 2620 | M124: 2499 | N124: 2080
K125: 37484 | L125: 2657 | M125: 2568 | N125: 2127
K126: 37491 | L126: 2716 | M126: 2634 | N126: 2171
K127: 37498 | L127: 2781 | M127: 2685 | N127: 2205
K128: 37505 | L128: 2855 | M128: 2721 | N128: 2274
K129: 37512 | L129: 2924 | M129: 2795 | N129: 2338
K130: 37519 | L130: 2991 | M130: 2857 | N130: 2412
K131: 37526 | L131: 3038 | M131: 2925 | N131: 2486
K132: 37533 | L132: 3080 | M132: 2998 | N132: 2547
K133: 37540 | L133: 3128 | M133: 3068 | N133: 2574
K134: 37547 | L134: 3161 | M134: =M82 -> 3100 | N134: =N82 -> 2644
K135: 37554 | L135: 3172 | M135: =M83 -> 3132 | N135: =N83 -> 2713
K136: 37561 | L136: 3145 | M136: =M84 -> 3185 | N136: =N84 -> 2748
K137: 37568 | M137: =M85 -> 3213 | N137: =N85 -> 2744
K138: 37575 | M138: =M86 -> 3194 | N138: =N86 -> 2654
K139: 37582 | M139: =M87 -> 3211 | N139: =N87 -> 2506
K140: 37589 | M140: =M88 -> 3204 | N140: =N88 -> 2434
K141: 37596 | M141: =M89 -> 3199 | N141: =N89 -> 2287
K142: 37603 | M142: =M90 -> 3168 | N142: =N90 -> 2140
K143: 37610 | M143: =M91 -> 3099 | N143: =N91 -> 1973