B3: Monthly Actual Data | I3: Monthly Estimates | K3: Weekly Estimates
A4: Month | B4: 1995 | C4: 1996 | D4: 1997 | E4: 1998 | F4: 1999 | G4: 2000 | I4: 2001 | O4: 6-Year High (1995-2000) | P4: 6-Year Low (1995-2000) | Q4: Difference
A5: January | B5: 2045 | C5: 1462.468304 | D5: 1495.563116 | E5: 1712 | F5: 2094 | G5: 1724.6516630000001 | I5: 1265 | J5: 36896 | K5: 1600.7142857142858 | L5: 35796 | M5: 35826 | N5: 1712 | O5: 2094 | P5: 1462 | Q5: =O5-P5 -> 632
A6: February | B6: 1542 | C6: 1020.58242 | D6: 1139.4220359999999 | E6: 1426 | F6: 1792 | G6: 1300.4144570000001 | I6: 912 | J6: 36903 | K6: 1497.7142857142858 | L6: 35827 | M6: 35854 | N6: 1426 | O6: 1792 | P6: 1021 | Q6: =O6-P6 -> 771
A7: March | B7: 1332 | C7: 757.994642 | D7: 990.43301299999996 | E7: 1183 | F7: 1430 | G7: 1149.9492420000001 | I7: 742 | J7: 36910 | K7: 1407.7142857142858 | L7: 35855 | M7: 35885 | N7: 1183 | O7: 1430 | P7: 758 | Q7: =O7-P7 -> 672
A8: April | B8: 1379 | C8: 853.96110799999997 | D8: 1051.234753 | E8: 1386 | F8: 1514 | G8: 1184.3404459999999 | J8: 36917 | K8: 1279.7142857142858 | L8: 35886 | M8: 35915 | N8: 1386 | O8: 1514 | P8: 854 | Q8: =O8-P8 -> 660
A9: May | B9: 1668 | C9: 1161.114546 | D9: 1364.797456 | E9: 1774 | F9: 1847 | G9: 1426.4080000000001 | J9: 36922 | K9: 1265 | L9: 35916 | M9: 35946 | N9: 1774 | O9: 1847 | P9: 1161 | Q9: =O9-P9 -> 686
A10: June | B10: 2014 | C10: 1529.1247699999999 | D10: 1731.1334360000001 | E10: 2114 | F10: 2157 | G10: 1706.3 | J10: 36924 | K10: 1235 | L10: 35947 | M10: 35976 | N10: 2114 | O10: 2157 | P10: 1529 | Q10: =O10-P10 -> 628
A11: July | B11: 2301 | C11: 1897.649343 | D11: 2016.5366449999999 | E11: 2428 | F11: 2390 | G11: 1996 | J11: 36931 | K11: 1140 | L11: 35977 | M11: 36007 | N11: 2428 | O11: 2428 | P11: 1898 | Q11: =O11-P11 -> 530
A12: August | B12: 2495 | C12: 2244.504117 | D12: 2337.911615 | E12: 2698 | F12: 2632 | G12: 2190 | J12: 36938 | K12: 1059 | L12: 36008 | M12: 36038 | N12: 2698 | O12: 2698 | P12: 2190 | Q12: =O12-P12 -> 508
A13: September | B13: 2802 | C13: 2604.9810189999998 | D13: 2672.3088520000001 | E13: 2928 | F13: 2884 | G13: 2473 | J13: 36945 | K13: 958 | L13: 36039 | M13: 36068 | N13: 2928 | O13: 2928 | P13: 2473 | Q13: =O13-P13 -> 455
A14: October | B14: 2996 | C14: 2810.4756400000001 | D14: 2885.777419 | E14: 3191 | F14: 3026 | G14: 2699 | J14: 36950 | K14: 912 | L14: 36069 | M14: 36099 | N14: 3191 | O14: 3191 | P14: 2699 | Q14: =O14-P14 -> 492
A15: November | B15: 2728 | C15: 2549.1373570000001 | D15: 2698.8862260000001 | E15: 3155 | F15: 2991 | G15: 2443 | J15: 36952 | K15: 891.14285714285711 | L15: 36100 | M15: 36129 | N15: 3155 | O15: 3155 | P15: 2443 | Q15: =O15-P15 -> 712
A16: December | B16: 2153 | C16: 2172.5511759999999 | D16: 2174.5195359999998 | E16: 2730 | F16: 2509 | G16: 1720 | J16: 36959 | K16: 816.14285714285711 | L16: 36130 | M16: 36160 | N16: 2730 | O16: 2730 | P16: 1720 | Q16: =O16-P16 -> 1010
J17: 36966 | K17: 793.14285714285711 | L17: 36161 | M17: 36191 | N17: 2094 | O17: 2094 | P17: 1462 | Q17: =O17-P17 -> 632
J18: 36973 | K18: 781.14285714285711 | L18: 36192 | M18: 36219 | N18: 1792 | O18: 1792 | P18: 1021 | Q18: =O18-P18 -> 771
J19: 36980 | K19: 732.14285714285711 | L19: 36220 | M19: 36250 | N19: 1430 | O19: 1430 | P19: 758 | Q19: =O19-P19 -> 672
J20: 36981 | K20: 734.14285714285711 | L20: 36251 | M20: 36280 | N20: 1514 | O20: 1514 | P20: 854 | Q20: =O20-P20 -> 660
J21: 36987 | K21: 746.14285714285711 | L21: 36281 | M21: 36311 | N21: 1847 | O21: 1847 | P21: 1161 | Q21: =O21-P21 -> 686
J22: 36994 | K22: 810.14285714285711 | L22: 36312 | M22: 36341 | N22: 2157 | O22: 2157 | P22: 1529 | Q22: =O22-P22 -> 628
J23: 37001 | K23: 853.14285714285711 | L23: 36342 | M23: 36372 | N23: 2390 | O23: 2428 | P23: 1898 | Q23: =O23-P23 -> 530
J24: 37008 | K24: 955.14285714285711 | L24: 36373 | M24: 36403 | N24: 2632 | O24: 2698 | P24: 2190 | Q24: =O24-P24 -> 508
J25: 37011 | L25: 36404 | M25: 36433 | N25: 2884 | O25: 2928 | P25: 2473 | Q25: =O25-P25 -> 455
J26: 37015 | L26: 36434 | M26: 36464 | N26: 3026 | O26: 3191 | P26: 2699 | Q26: =O26-P26 -> 492
J27: 37022 | L27: 36465 | M27: 36494 | N27: 2991 | O27: 3155 | P27: 2443 | Q27: =O27-P27 -> 712
J28: 37029 | L28: 36495 | M28: 36525 | N28: 2509 | O28: 2730 | P28: 1720 | Q28: =O28-P28 -> 1010
J29: 37036 | L29: 36526 | M29: 36556 | N29: 1724.6516630000001 | O29: 2094 | P29: 1462 | Q29: =O29-P29 -> 632
J30: 37042 | L30: 36557 | M30: 36585 | N30: 1300.4144570000001 | O30: 1792 | P30: 1021 | Q30: =O30-P30 -> 771
J31: 37043 | L31: 36586 | M31: 36616 | N31: 1149.9492420000001 | O31: 1430 | P31: 758 | Q31: =O31-P31 -> 672
J32: 37050 | L32: 36617 | M32: 36646 | N32: 1184.3404459999999 | O32: 1514 | P32: 854 | Q32: =O32-P32 -> 660
J33: 37057 | L33: 36647 | M33: 36677 | N33: 1426.4080000000001 | O33: 1847 | P33: 1161 | Q33: =O33-P33 -> 686
J34: 37064 | L34: 36678 | M34: 36707 | N34: 1706.3 | O34: 2157 | P34: 1529 | Q34: =O34-P34 -> 628
J35: 37071 | L35: 36708 | M35: 36738 | N35: 1996 | O35: 2428 | P35: 1898 | Q35: =O35-P35 -> 530
J36: 37072 | L36: 36739 | M36: 36769 | N36: 2190 | O36: 2698 | P36: 2190 | Q36: =O36-P36 -> 508
J37: 37078 | L37: 36770 | M37: 36799 | N37: 2473 | O37: 2928 | P37: 2473 | Q37: =O37-P37 -> 455
J38: 37085 | L38: 36800 | M38: 36830 | N38: 2699 | O38: 3191 | P38: 2699 | Q38: =O38-P38 -> 492
J39: 37092 | L39: 36831 | M39: 36860 | N39: 2443 | O39: 3155 | P39: 2443 | Q39: =O39-P39 -> 712
J40: 37099 | L40: 36861 | M40: 36891 | N40: 1720 | O40: 2730 | P40: 1720 | Q40: =O40-P40 -> 1010
J41: 37103 | L41: 36892 | M41: 36922 | N41: 1265 | O41: 2094 | P41: 1462 | Q41: =O41-P41 -> 632
J42: 37106 | L42: 36923 | M42: 36950 | N42: 912 | O42: 1792 | P42: 1021 | Q42: =O42-P42 -> 771
J43: 37113 | L43: 36952 | M43: 36952 | N43: 891.14285714285711 | O43: =2*(O$31-O$30)/31+O42 -> 1768.6451612903227 | P43: =2*(P$31-P$30)/31+P42 -> 1004.0322580645161 | Q43: =O43-P43 -> 764.61290322580658
J44: 37120 | L44: 36959 | M44: 36959 | N44: 816.14285714285711 | O44: =7*(O$31-O$30)/31+O43 -> 1686.9032258064517 | P44: =7*(P$31-P$30)/31+P43 -> 944.64516129032256 | Q44: =O44-P44 -> 742.25806451612914
J45: 37127 | L45: 36966 | M45: 36966 | N45: 793.14285714285711 | O45: =7*(O$31-O$30)/31+O44 -> 1605.1612903225807 | P45: =7*(P$31-P$30)/31+P44 -> 885.25806451612902 | Q45: =O45-P45 -> 719.9032258064517
J46: 37134 | L46: 36973 | M46: 36973 | N46: 781.14285714285711 | O46: =7*(O$31-O$30)/31+O45 -> 1523.4193548387098 | P46: =7*(P$31-P$30)/31+P45 -> 825.87096774193549 | Q46: =O46-P46 -> 697.54838709677426
J47: 37141 | L47: 36980 | M47: 36980 | N47: 732.14285714285711 | O47: =7*(O$31-O$30)/31+O46 -> 1441.6774193548388 | P47: =7*(P$31-P$30)/31+P46 -> 766.48387096774195 | Q47: =O47-P47 -> 675.19354838709683
J48: 37148 | L48: 36981 | M48: 36981 | N48: 734.14285714285711 | O48: =1*(O$31-O$30)/31+O47 -> 1430 | P48: =1*(P$31-P$30)/31+P47 -> 758 | Q48: =O48-P48 -> 672
J49: 37155 | L49: 36987 | M49: 36987 | N49: 746.14285714285711 | O49: =6*(O$32-O$31)/30+O48 -> 1446.8 | P49: =6*(P$32-P$31)/30+P48 -> 777.2 | Q49: =O49-P49 -> 669.6
J50: 37162 | L50: 36994 | M50: 36994 | N50: 810.14285714285711 | O50: =7*(O$32-O$31)/30+O49 -> 1466.4 | P50: =7*(P$32-P$31)/30+P49 -> 799.6 | Q50: =O50-P50 -> 666.8
J51: 37164 | L51: 37001 | M51: 37001 | N51: 853.14285714285711 | O51: =7*(O$32-O$31)/30+O50 -> 1486 | P51: =7*(P$32-P$31)/30+P50 -> 822 | Q51: =O51-P51 -> 664
J52: 37169 | L52: 37008 | M52: 37008 | N52: 955 | O52: =7*(O$32-O$31)/30+O51 -> 1505.6 | P52: =7*(P$32-P$31)/30+P51 -> 844.4 | Q52: =O52-P52 -> 661.2
J53: 37176 | L53: 37015 | M53: 37015 | N53: 1063 | O53: =3*(O$32-O$31)/30+4*(O$33-O$32)/31+O52 -> 1556.9677419354834 | P53: =3*(P$32-P$31)/30+4*(P$33-P$32)/31+P52 -> 893.61290322580646 | Q53: =O53-P53 -> 663.35483870967698
J54: 37183 | L54: 37022 | M54: 37022 | N54: 1169 | O54: =7*(O$33-O$32)/31+O53 -> 1632.1612903225803 | P54: =7*(P$33-P$32)/31+P53 -> 962.9354838709678 | Q54: =O54-P54 -> 669.22580645161247
J55: 37190 | L55: 37029 | M55: 37029 | N55: 1287 | O55: =7*(O$33-O$32)/31+O54 -> 1707.3548387096771 | P55: =7*(P$33-P$32)/31+P54 -> 1032.258064516129 | Q55: =O55-P55 -> 675.09677419354807
J56: 37195 | L56: 37036 | M56: 37036 | N56: 1394 | O56: =7*(O$33-O$32)/31+O55 -> 1782.5483870967739 | P56: =7*(P$33-P$32)/31+P55 -> 1101.5806451612902 | Q56: =O56-P56 -> 680.96774193548367
J57: 37197 | L57: 37043 | M57: 37043 | N57: 1511 | O57: =6*(O$33-O$32)/31+1*(O$34-O$33)/30+O56 -> 1857.333333333333 | P57: =6*(P$33-P$32)/31+1*(P$34-P$33)/30+P56 -> 1173.2666666666667 | Q57: =O57-P57 -> 684.06666666666638
L58: 37050 | M58: 37050 | N58: 1616 | O58: =7*(O$34-O$33)/30+O57 -> 1929.6666666666663 | P58: =7*(P$34-P$33)/30+P57 -> 1259.1333333333332 | Q58: =O58-P58 -> 670.53333333333308
L59: =+L58+7 -> 37057 | M59: =+M58+7 -> 37057 | N59: 1722 | O59: =7*(O$34-O$33)/30+O58 -> 2002 | P59: =7*(P$34-P$33)/30+P58 -> 1345 | Q59: =O59-P59 -> 657
L60: =+L59+7 -> 37064 | M60: =+M59+7 -> 37064 | N60: 1830 | O60: =7*(O$34-O$33)/30+O59 -> 2074.333333333333 | P60: =7*(P$34-P$33)/30+P59 -> 1430.8666666666663 | Q60: =O60-P60 -> 643.4666666666667
L61: =+L60+7 -> 37071
L62: =+L61+7 -> 37078