A1: Spot Prices ($ per MMBtu) | B1: Thur. | C1: Fri. | D1: Mon. | E1: Tues. | F1: Wed.
B2: 37504 | C2: 37505 | D2: 37508 | E2: 37507 | F2: 37508
A3: Henry Hub | B3: 3.19 | C3: 3.38 | D3: 3.24 | E3: 3.35 | F3: 3.32
A4: New York | B4: 3.50 | C4: 3.75 | D4: 3.62 | E4: 3.62 | F4: 3.60
A5: Chicago | B5: 3.20 | C5: 3.40 | D5: 3.23 | E5: 3.36 | F5: 3.35
A6: Cal. Comp. Avg,* | B6: 2.96 | C6: 3.0733333333333337 | D6: 2.9833333333333329 | E6: 3.1166666666666667 | F6: 3.1266666666666665
A7: Futures ($/MMBtu)
A8: Oct delivery | B8: 3.3420000000000001 | C8: 3.2650000000000001 | D8: 3.399 | E8: 3.3559999999999999 | F8: 3.250
A9: Nov delivery | B9: 3.6539999999999999 | C9: 3.605 | D9: 3.7440000000000002 | E9: 3.734 | F9: 3.645
A10: *Avg. of NGI's reported avg. prices for: Malin, PG&E citygate,
A11: and Southern California Border Avg.
A12: Source: NGI's Daily Gas Price Index (http://intelligencepress.com).

A1: All Volumes in Bcf | B1: Current Stocks 9/6//2002 | C1: Estimated Prior 5-Year (1997-2001) Average | D1: Percent Difference from 5 Year Average | E1: Implied Net Change from Last Week | F1: One-Week Prior Stocks 8/30/02
A2: East Region | B2: 1642 | C2: 1546 | D2: 6.2E-2 | E2: 52 | F2: 1590
A3: West Region | B3: 390 | C3: 324 | D3: 0.20399999999999999 | E3: 9 | F3: 381
A4: Producing Region | B4: 823 | C4: 671 | D4: 0.22700000000000001 | E4: 13 | F4: 810
A5: Total Lower 48 | B5: 2855 | C5: 2542 | D5: 0.123 | E5: 74 | F5: 2781
A6: Source: Energy Information Administration: Form EIA-912, "Weekly Underground Natural Gas Storage Report," and the Historical Weekly Storage Estimates Database.

A1: Monthly Natural Gas Market Summary
B2: History | E2: Projections
B3: 37408 | C3: 37438 | D3: 37469 | E3: 37500 | F3: 37530 | G3: 37561
A4: PRICES ($/MMBtu)
A5: Average Wellhead Price | B5: 2.8821811100292116 | C5: 2.8140214216163586 | D5: 2.7443281402142166 | E5: 2.7051110029211296 | F5: 2.7461596884128534 | G5: 2.9245813047711784
A6: Residential Price | B6: 8.7974011684518025 | C6: 9.2282775073028258 | D6: 9.4296553067185975 | E6: 9.0689532619279465 | F6: 8.0857604673807213 | G6: 7.4444391431353463
A7: Electric Utilities Price | B7: 3.2580040000000001 | C7: 3.0180479999999998 | D7: 2.8896169999999999 | E7: 2.815067 | F7: 2.924671 | G7: 3.2514639999999999
A9: SUPPLY (Trillion Cubic Feet)
A10: Total Dry Gas Prod | B10: 1.5538404000000001 | C10: 1.5975539999999999 | D10: 1.5949453499999999 | E10: 1.5417000000000001 | F10: 1.5990110000000002 | G10: 1.5749403
A11: Net Imports | B11: 0.24989821899999998 | C11: 0.27692393000000004 | D11: 0.28437257899999996 | E11: 0.26538930000000005 | F11: 0.27912124100000002 | G11: 0.27136838999999996
A12: Imports | B12: 0.28915721300000002 | C12: 0.32014196 | D12: 0.33075791000000004 | E12: 0.31250759999999994 | F12: 0.3272391 | G12: 0.31831619999999999
A13: Exports | B13: 3.9258993999999998E-2 | C13: 4.3217968000000002E-2 | D13: 4.6385331000000002E-2 | E13: 4.7118179999999996E-2 | F13: 4.8117982999999996E-2 | G13: 4.6947899999999994E-2
A14: Suppl. Gaseous Fuels | B14: 5.3037757782800005E-3 | C14: 6.2197501000000009E-3 | D14: 6.2731476E-3 | E14: 6.0375450000000001E-3 | F14: 6.135575800000001E-3 | G14: 7.1532449999999999E-3
A15: Total New Supply | B15: =+SUM(B10,B11,B14) -> 1.8090423947782801 | C15: =+SUM(C10,C11,C14) -> 1.8806976800999999 | D15: =+SUM(D10,D11,D14) -> 1.8855910765999999 | E15: =+SUM(E10,E11,E14) -> 1.8131268450000002 | F15: =+SUM(F10,F11,F14) -> 1.8842678168000002 | G15: =+SUM(G10,G11,G14) -> 1.8534619349999999
A17: Working Gas in Storage
A18: Opening | B18: 1.9681250529999998 | C18: 2.308174782 | D18: 2.5575714285714284 | E18: 2.774 | F18: 3.0569999999999999 | G18: 3.220
A19: Closing | B19: 2.308174782 | C19: 2.5575714285714284 | D19: 2.774 | E19: 3.0569999999999999 | F19: 3.220 | G19: 3.069
A20: Net Storage Withdrawal | B20: =+B18-B19 -> -0.34004972900000019 | C20: =+C18-C19 -> -0.24939664657142835 | D20: =+D18-D19 -> -0.21642857142857164 | E20: =+E18-E19 -> -0.28299999999999992 | F20: =+F18-F19 -> -0.16300000000000026 | G20: =+G18-G19 -> 0.15100000000000025
A22: Total Supply | B22: =+B15+B20 -> 1.4689926657782799 | C22: =+C15+C20 -> 1.6313010335285716