A1: Spot Prices ($ per MMBtu) | B1: Thur. | C1: Fri. | D1: Mon. | E1: Tues. | F1: Wed.
B2: 37763 | C2: 37764 | D2: 37767 | E2: 37768 | F2: 37769
A3: Henry Hub | B3: 6.09 | C3: 5.91 | D3: 5.91 | E3: 5.84 | F3: 5.71
A4: New York | B4: 6.55 | C4: 6.33 | D4: 6.33 | E4: 6.31 | F4: 6.13
A5: Chicago | B5: 6.06 | C5: 5.87 | D5: 5.87 | E5: 5.86 | F5: 5.72
A6: Cal. Comp. Avg,* | B6: 5.71 | C6: 5.4333333333333336 | D6: 5.4333333333333336 | E6: 5.52 | F6: 5.4666666666666659
A7: Futures ($/MMBtu)
A8: Jun delivery | B8: 6.0350000000000001 | C8: 6.1189999999999998 | D8: holiday | E8: 5.900 | F8: 5.9450000000000003
A9: Jul delivery | B9: 6.1429999999999998 | C9: 6.226 | D9: holiday | E9: 6.0110000000000001 | F9: 6.016
A10: *Avg. of NGI's reported avg. prices for: Malin, PG&E citygate,
A11: and Southern California Border Avg.
A12: Source: NGI's Daily Gas Price Index (http://intelligencepress.com).

B1: Estimated Average Wellhead Prices
C2: 37530 | D2: 37591 | E2: 37622 | F2: 37653 | G2: 37681 | H2: Apr-03
B3: Price ($ per Mcf) | C3: 3.3523505296600127 | D3: 3.8364917719474381 | E3: 4.4657990421194231 | F3: 5.44755124726366 | G3: 6.6926230013040779 | H3: 4.71
B4: Price ($ per MMBtu) | C4: =B3*1.025 -> 3.4361592929015128 | D4: =D3*1.025 -> 3.9324040662461237 | E4: =E3*1.025 -> 4.5774440181724083 | F4: =F3*1.025 -> 5.5837400284452512 | G4: =G3*1.025 -> 6.8599385763366794 | H4: 4.59
B5: Note: The price data in this table are a pre-release of the average wellhead price that will be published in forthcoming issues of the Natural Gas Monthly. Prices were converted from $ per Mcf to $ per MMBtu using an average heat content of 1,025 Btu per cubic foot as published in Table A2 of the Annual Energy Review 2001.
B6: Source: Energy Information Administration, Office of Oil and Gas.

A1: All Volumes in Bcf | B1: Current Stocks 5/23/03 | C1: Estimated Prior 5-Year (1998-2002) Average | D1: Percent Difference from 5 Year Average | E1: Implied Net Change from Last Week | F1: One-Week Prior Stocks 5/16/03
A2: East Region | B2: 559 | C2: 833 | D2: -0.32900000000000001 | E2: 63 | F2: 496
A3: West Region | B3: 216 | C3: 223 | D3: -3.1E-2 | E3: 10 | F3: 206
A4: Producing Region | B4: 310 | C4: 537 | D4: -0.42299999999999999 | E4: 22 | F4: 288
A5: Total Lower 48 | B5: 1085 | C5: 1593 | D5: -0.31900000000000001 | E5: 95 | F5: 990
A6: Source: Energy Information Administration: Form EIA-912, "Weekly Underground Natural Gas Storage Report," and the Historical Weekly Storage Estimates Database. Row and column sums may not equal totals due to independent rounding.