A1: xxxxx
A2: Home > Natural Gas > Natural Gas Weekly Update
A3: Printer-Friendly Version

A1: Weekly Natural Gas Storage
A2: Natural Gas Transportation: Infrastructure Issues and Operations Trends
A3: An Assessment of Recent Natural Gas Market Trends
A4: U.S. Natural Gas Markets: Recent Trends and prospects for the future
A5: Impact of Interruptible Natural Gas Service
A6: Previous Issues of Natural Gas Weekly Update
A7: Natural Gas Homepage

A1: <!-- /* Font Definitions */ @font-face {font-family:Wingdings; panose-1:5 0 0 0 0 0 0 0 0 0; mso-font-charset:2; mso-generic-font-family:auto; mso-font-pitch:variable; mso-font-signature:0 268435456 0 0 -2147483648 0;} @font-face {font-family:Tahoma; panose-1:2 11 6 4 3 5 4 4 2 4; mso-font-charset:0; mso-generic-font-family:swiss; mso-font-pitch:variable; mso-font-signature:553679495 -2147483648 8 0 66047 0;} @font-face {font-family:"CG Times"; panose-1:0 0 0 0 0 0 0 0 0 0; mso-font-alt:"Times New Roman"; mso-font-charset:0; mso-generic-font-family:roman; mso-font-format:other; mso-font-pitch:variable; mso-font-signature:3 0 0 0 1 0;} @font-face {font-family:"Arial Unicode MS"; panose-1:2 11 6 4 2 2 2 2 2 4; mso-font-charset:128; mso-generic-font-family:swiss; mso-font-pitch:variable; mso-font-signature:-1 -369098753 63 0 4129023 0;} @font-face {font-family:"\@Arial Unicode MS"; mso-font-charset:128; mso-generic-font-family:swiss; mso-font-pitch:variable; mso-font-signature:-1 -369098753 63 0 4129023 0;} /* Style Definitions */ p.MsoNormal, li.MsoNormal, div.MsoNormal {mso-style-parent:""; margin:0in; margin-bottom:.0001pt; mso-pagination:widow-orphan; font-size:10.0pt; font-family:"Times New Roman"; mso-fareast-font-family:"Times New Roman";} h1 {mso-style-next:Normal; margin:0in; margin-bottom:.0001pt; mso-pagination:widow-orphan; page-break-after:avoid; mso-outline-level:1; font-size:10.0pt; font-family:"Times New Roman"; mso-font-kerning:0pt; font-weight:normal; text-decoration:underline; text-underline:single;} h2 {mso-style-next:Normal; margin-top:12.0pt; margin-right:0in; margin-bottom:3.0pt; margin-left:0in; mso-pagination:widow-orphan; page-break-after:avoid; mso-outline-level:2; font-size:12.0pt; mso-bidi-font-size:10.0pt; font-family:Arial; font-weight:bold; mso-bidi-font-weight:normal; font-style:italic; mso-bidi-font-style:normal;} h3 {mso-style-next:Normal; margin-top:12.0pt; margin-right:0in; margin-bottom:3.0pt; margin-left:0in; mso-pagination:widow-orphan; page-break-after:avoid; mso-outline-level:3; font-size:12.0pt; mso-bidi-font-size:10.0pt; font-family:Arial; font-weight:normal;} h4 {mso-style-next:Normal; margin-top:12.0pt; margin-right:0in; margin-bottom:3.0pt; margin-left:0in; mso-pagination:widow-orphan; page-break-after:avoid; mso-outline-level:4; font-size:12.0pt; mso-bidi-font-size:10.0pt; font-family:Arial; font-weight:bold; mso-bidi-font-weight:normal;} h5 {mso-style-next:Normal; margin-top:12.0pt; margin-right:0in; margin-bottom:3.0pt; margin-left:0in; mso-pagination:widow-orphan; mso-outline-level:5; font-size:11.0pt; mso-bidi-font-size:10.0pt; font-family:"Times New Roman"; font-weight:normal;} h6 {mso-style-next:Normal; margin-top:12.0pt; margin-right:0in; margin-bottom:3.0pt; margin-left:0in; mso-pagination:widow-orphan; mso-outline-level:6; font-size:11.0pt; mso-bidi-font-size:10.0pt; font-family:"Times New Roman"; font-weight:normal; font-style:italic; mso-bidi-font-style:normal;} p.MsoHeading7, li.MsoHeading7, div.MsoHeading7 {mso-style-next:Normal; margin-top:12.0pt; margin-right:0in; margin-bottom:3.0pt; margin-left:0in; mso-pagination:widow-orphan; mso-outline-level:7; font-size:10.0pt; font-family:Arial; mso-fareast-font-family:"Times New Roman"; mso-bidi-font-family:"Times New Roman";} p.MsoHeading8, li.MsoHeading8, div.MsoHeading8 {mso-style-next:Normal; margin-top:12.0pt; margin-right:0in; margin-bottom:3.0pt; margin-left:0in; mso-pagination:widow-orphan; mso-outline-level:8; font-size:10.0pt; font-family:Arial; mso-fareast-font-family:"Times New Roman"; mso-bidi-font-family:"Times New Roman"; font-style:italic; mso-bidi-font-style:normal;} p.MsoHeading9, li.MsoHeading9, div.MsoHeading9 {mso-style-next:Normal; margin-top:12.0pt; margin-right:0in; margin-bottom:3.0pt; margin-left:0in; mso-pagination:widow-orphan; mso-outline-level:9; font-size:9.0pt; mso-bidi-font-size:10.0pt; font-family:Arial; mso-fareast-font-family:"Times New Roman"; mso-bidi-font-family:"Times New Roman"; font-weight:bold; mso-bidi-font-weight:normal; font-style:italic; mso-bidi-font-style:normal;} p.MsoIndex1, li.MsoIndex1, div.MsoIndex1 {mso-style-update:auto; mso-style-next:Normal; margin-top:0in; margin-right:0in; margin-bottom:0in; margin-left:10.0pt; margin-bottom:.0001pt; text-indent:-10.0pt; mso-pagination:widow-orphan; font-size:10.0pt; font-family:"Times New Roman"; mso-fareast-font-family:"Times New Roman";} p.MsoIndex2, li.MsoIndex2, div.MsoIndex2 {mso-style-update:auto; mso-style-next:Normal; margin-top:0in; margin-right:0in; margin-bottom:0in; margin-left:20.0pt; margin-bottom:.0001pt; text-indent:-10.0pt; mso-pagination:widow-orphan; font-size:10.0pt; font-family:"Times New Roman"; mso-fareast-font-family:"Times New Roman";} p.MsoIndex3, li.MsoIndex3, div.MsoIndex3 {mso-style-update:auto; mso-style-next:Normal; margin-top:0in; margin-right:0in; margin-bottom:0in; margin-left:30.0pt; margin-bottom:.0001pt; text-indent:-10.0pt; mso-pagination:widow-orphan; font-size:10.0pt; font-family:"Times New Roman"; mso-fareast-font-family:"Times New Roman";} p.MsoIndex4, li.MsoIndex4, div.MsoIndex4 {mso-style-update:auto; mso-style-next:Normal; margin-top:0in; margin-right:0in; margin-bottom:0in; margin-left:40.0pt; margin-bottom:.0001pt; text-indent:-10.0pt; mso-pagination:widow-orphan; font-size:10.0pt; font-family:"Times New Roman"; mso-fareast-font-family:"Times New Roman";} p.MsoIndex5, li.MsoIndex5, div.MsoIndex5 {mso-style-update:auto; mso-style-next:Normal; margin-top:0in; margin-right:0in; margin-bottom:0in; margin-left:50.0pt; margin-bottom:.0001pt; text-indent:-10.0pt; mso-pagination:widow-orphan; font-size:10.0pt; font-family:"Times New Roman"; mso-fareast-font-family:"Times New Roman";} p.MsoIndex6, li.MsoIndex6, div.MsoIndex6 {mso-style-update:auto; mso-style-next:Normal; margin-top:0in; margin-right:0in; margin-bottom:0in; margin-left:60.0pt; margin-bottom:.0001pt; text-indent:-10.0pt; mso-pagination:widow-orphan; font-size:10.0pt; font-family:"Times New Roman"; mso-fareast-font-family:"Times New Roman";} p.MsoIndex7, li.MsoIndex7, div.MsoIndex7 {mso-style-update:auto; mso-style-next:Normal; margin-top:0in; margin-right:0in; margin-bottom:0in; margin-left:70.0pt; margin-bottom:.0001pt; text-indent:-10.0pt; mso-pagination:widow-orphan; font-size:10.0pt; font-family:"Times New Roman"; mso-fareast-font-family:"Times New Roman";} p.MsoIndex8, li.MsoIndex8, div.MsoIndex8 {mso-style-update:auto; mso-style-next:Normal; margin-top:0in; margin-right:0in; margin-bottom:0in; margin-left:80.0pt; margin-bottom:.0001pt; text-indent:-10.0pt; mso-pagination:widow-orphan; font-size:10.0pt; font-family:"Times New Roman"; mso-fareast-font-family:"Times New Roman";} p.MsoIndex9, li.MsoIndex9, div.MsoIndex9 {mso-style-update:auto; mso-style-next:Normal; margin-top:0in; margin-right:0in; margin-bottom:0in; margin-left:1.25in; margin-bottom:.0001pt; text-indent:-10.0pt; mso-pagination:widow-orphan; font-size:10.0pt; font-family:"Times New Roman"; mso-fareast-font-family:"Times New Roman";} p.MsoToc1, li.MsoToc1, div.MsoToc1 {mso-style-update:auto; mso-style-next:Normal; margin:0in; margin-bottom:.0001pt; mso-pagination:widow-orphan; font-size:10.0pt; font-family:"Times New Roman"; mso-fareast-font-family:"Times New Roman";} p.MsoToc2, li.MsoToc2, div.MsoToc2 {mso-style-update:auto; mso-style-next:Normal; margin-top:0in; margin-right:0in; margin-bottom:0in; margin-left:10.0pt; margin-bottom:.0001pt; mso-pagination:widow-orphan; font-size:10.0pt; font-family:"Times New Roman"; mso-fareast-font-family:"Times New Roman";} p.MsoToc3, li.MsoToc3, div.MsoToc3 {mso-style-update:auto; mso-style-next:Normal; margin-top:0in; margin-right:0in; margin-bottom:0in; margin-left:20.0pt; margin-bottom:.0001pt; mso-pagination:widow-orphan; font-size:10.0pt; font-family:"Times New Roman"; mso-fareast-font-family:"Times New Roman";} p.MsoToc4, li.MsoToc4, div.MsoToc4 {mso-style-update:auto; mso-style-next:Normal; margin-top:0in; margin-right:0in; margin-bottom:0in; margin-left:30.0pt; margin-bottom:.0001pt; mso-pagination:widow-orphan; font-size:10.0pt; font-family:"Times New Roman"; mso-fareast-font-family:"Times New Roman";} p.MsoToc5, li.MsoToc5, div.MsoToc5 {mso-style-update:auto; mso-style-next:Normal; margin-top:0in; margin-right:0in; margin-bottom:0in; margin-left:40.0pt; margin-bottom:.0001pt; mso-pagination:widow-orphan; font-size:10.0pt; font-family:"Times New Roman"; mso-fareast-font-family:"Times New Roman";} p.MsoToc6, li.MsoToc6, div.MsoToc6 {mso-style-update:auto; mso-style-next:Normal; margin-top:0in; margin-right:0in; margin-bottom:0in; margin-left:50.0pt; margin-bottom:.0001pt; mso-pagination:widow-orphan; font-size:10.0pt; font-family:"Times New Roman"; mso-fareast-font-family:"Times New Roman";} p.MsoToc7, li.MsoToc7, div.MsoToc7 {mso-style-update:auto; mso-style-next:Normal; margin-top:0in; margin-right:0in; margin-bottom:0in; margin-left:60.0pt; margin-bottom:.0001pt; mso-pagination:widow-orphan; font-size:10.0pt; font-family:"Times New Roman"; mso-fareast-font-family:"Times New Roman";} p.MsoToc8, li.MsoToc8, div.MsoToc8 {mso-style-update:auto; mso-style-next:Normal; margin-top:0in; margin-right:0in; margin-bottom:0in; margin-left:70.0pt; margin-bottom:.0001pt; mso-pagination:widow-orphan; font-size:10.0pt; font-family:"Times New Roman"; mso-fareast-font-family:"Times New Roman";} p.MsoToc9, li.MsoToc9, div.MsoToc9 {mso-style-update:auto; mso-style-next:Normal; margin-top:0in; margin-right:0in; margin-bottom:0in; margin-left:80.0pt; margin-bottom:.0001pt; mso-pagination:widow-orphan; font-size:10.0pt; font-family:"Times New Roman"; mso-fareast-font-family:"Times New Roman";} p.MsoNormalIndent, li.MsoNormalIndent, div.MsoNormalIndent {margin-top:0in; margin-right:0in; margin-bottom:0in; margin-left:.5in; margin-bottom:.0001pt; mso-pagination:widow-orphan; font-size:10.0pt; font-family:"Times New Roman"; mso-fareast-font-family:"Times New Roman";} p.MsoFootnoteText, li.MsoFootnoteText, div.MsoFootnoteText {margin:0in; margin-bottom:.0001pt; mso-pagination:widow-orphan; font-size:10.0pt; font-family:"Times New Roman"; mso-fareast-font-family:"Times New Roman";} p.MsoCommentText, li.MsoCommentText, div.MsoCommentText {margin:0in; margin-bottom:.0001pt; mso-pagination:widow-orphan; font-size:10.0pt; font-family:"Times New Roman"; mso-fareast-font-family:"Times New Roman";} p.MsoHeader, li.MsoHeader, div.MsoHeader {margin:0in; margin-bottom:.0001pt; mso-pagination:widow-orphan; tab-stops:center 3.0in right 6.0in; font-size:10.0pt; font-family:"Times New Roman"; mso-fareast-font-family:"Times New Roman";} p.MsoFooter, li.MsoFooter, div.MsoFooter {margin:0in; margin-bottom:.0001pt; mso-pagination:widow-orphan; tab-stops:center 3.0in right 6.0in; font-size:10.0pt; font-family:"Times New Roman"; mso-fareast-font-family:"Times New Roman";} p.MsoIndexHeading, li.MsoIndexHeading, div.MsoIndexHeading {mso-style-next:"Index 1"; margin:0in; margin-bottom:.0001pt; mso-pagination:widow-orphan; font-size:10.0pt; font-family:Arial; mso-fareast-font-family:"Times New Roman"; mso-bidi-font-family:"Times New Roman"; font-weight:bold; mso-bidi-font-weight:normal;} p.MsoCaption, li.MsoCaption, div.MsoCaption {mso-style-next:Normal; margin-top:6.0pt; margin-right:0in; margin-bottom:6.0pt; margin-left:0in; mso-pagination:widow-orphan; font-size:10.0pt; font-family:"Times New Roman"; mso-fareast-font-family:"Times New Roman"; font-weight:bold; mso-bidi-font-weight:normal;} p.MsoTof, li.MsoTof, div.MsoTof {mso-style-next:Normal; margin-top:0in; margin-right:0in; margin-bottom:0in; margin-left:20.0pt; margin-bottom:.0001pt; text-indent:-20.0pt; mso-pagination:widow-orphan; font-size:10.0pt; font-family:"Times New Roman"; mso-fareast-font-family:"Times New Roman";} p.MsoEnvelopeAddress, li.MsoEnvelopeAddress, div.MsoEnvelopeAddress {margin-top:0in; margin-right:0in; margin-bottom:0in; margin-left:2.0in; margin-bottom:.0001pt; mso-pagination:widow-orphan; mso-element:frame; mso-element-frame-width:5.5in; mso-element-frame-height:99.0pt; mso-element-frame-hspace:9.0pt; mso-element-wrap:auto; mso-element-anchor-horizontal:page; mso-element-left:center; mso-element-top:bottom; font-size:12.0pt; mso-bidi-font-size:10.0pt; font-family:Arial; mso-fareast-font-family:"Times New Roman"; mso-bidi-font-family:"Times New Roman";} p.MsoEnvelopeReturn, li.MsoEnvelopeReturn, div.MsoEnvelopeReturn {margin:0in; margin-bottom:.0001pt; mso-pagination:widow-orphan; font-size:10.0pt; font-family:Arial; mso-fareast-font-family:"Times New Roman"; mso-bidi-font-family:"Times New Roman";} span.MsoFootnoteReference {vertical-align:super;} span.MsoCommentReference {mso-ansi-font-size:8.0pt; mso-bidi-font-size:8.0pt;} p.MsoEndnoteText, li.MsoEndnoteText, div.MsoEndnoteText {margin:0in; margin-bottom:.0001pt; mso-pagination:widow-orphan; font-size:10.0pt; font-family:"Times New Roman"; mso-fareast-font-family:"Times New Roman";} p.MsoToa, li.MsoToa, div.MsoToa {mso-style-next:Normal; margin-top:0in; margin-right:0in; margin-bottom:0in; margin-left:10.0pt; margin-bottom:.0001pt; text-indent:-10.0pt; mso-pagination:widow-orphan; font-size:10.0pt; font-family:"Times New Roman"; mso-fareast-font-family:"Times New Roman";} p.MsoMacroText, li.MsoMacroText, div.MsoMacroText {mso-style-parent:""; margin:0in; margin-bottom:.0001pt; mso-pagination:widow-orphan; tab-stops:24.0pt 48.0pt 1.0in 96.0pt 120.0pt 2.0in 168.0pt 192.0pt 3.0in; font-size:10.0pt; font-family:"Courier New"; mso-fareast-font-family:"Times New Roman"; mso-bidi-font-family:"Times New Roman";} p.MsoToaHeading, li.MsoToaHeading, div.MsoToaHeading {mso-style-next:Normal; margin-top:6.0pt; margin-right:0in; margin-bottom:0in; margin-left:0in; margin-bottom:.0001pt; mso-pagination:widow-orphan; font-size:12.0pt; mso-bidi-font-size:10.0pt; font-family:Arial; mso-fareast-font-family:"Times New Roman"; mso-bidi-font-family:"Times New Roman"; font-weight:bold; mso-bidi-font-weight:normal;} p.MsoList, li.MsoList, div.MsoList {margin-top:0in; margin-right:0in; margin-bottom:0in; margin-left:.25in; margin-bottom:.0001pt; text-indent:-.25in; mso-pagination:widow-orphan; font-size:10.0pt; font-family:"Times New Roman"; mso-fareast-font-family:"Times New Roman";} p.MsoListBullet, li.MsoListBullet, div.MsoListBullet {mso-style-update:auto; margin-top:0in; margin-right:0in; margin-bottom:0in; margin-left:.25in; margin-bottom:.0001pt; text-indent:-.25in; mso-pagination:widow-orphan; mso-list:l9 level1 lfo3; tab-stops:list .25in; font-size:10.0pt; font-family:"Times New Roman"; mso-fareast-font-family:"Times New Roman";} p.MsoListNumber, li.MsoListNumber, div.MsoListNumber {margin-top:0in; margin-right:0in; margin-bottom:0in; margin-left:.25in; margin-bottom:.0001pt; text-indent:-.25in; mso-pagination:widow-orphan; mso-list:l8 level1 lfo6; tab-stops:list .25in; font-size:10.0pt; font-family:"Times New Roman"; mso-fareast-font-family:"Times New Roman";} p.MsoList2, li.MsoList2, div.MsoList2 {margin-top:0in; margin-right:0in; margin-bottom:0in; margin-left:.5in; margin-bottom:.0001pt; text-indent:-.25in; mso-pagination:widow-orphan; font-size:10.0pt; font-family:"Times New Roman"; mso-fareast-font-family:"Times New Roman";} p.MsoList3, li.MsoList3, div.MsoList3 {margin-top:0in; margin-right:0in; margin-bottom:0in; margin-left:.75in; margin-bottom:.0001pt; text-indent:-.25in; mso-pagination:widow-orphan; font-size:10.0pt; font-family:"Times New Roman"; mso-fareast-font-family:"Times New Roman";} p.MsoList4, li.MsoList4, div.MsoList4 {margin-top:0in; margin-right:0in; margin-bottom:0in; margin-left:1.0in; margin-bottom:.0001pt; text-indent:-.25in; mso-pagination:widow-orphan; font-size:10.0pt; font-family:"Times New Roman"; mso-fareast-font-family:"Times New Roman";} p.MsoList5, li.MsoList5, div.MsoList5 {margin-top:0in; margin-right:0in; margin-bottom:0in; margin-left:1.25in; margin-bottom:.0001pt; text-indent:-.25in; mso-pagination:widow-orphan; font-size:10.0pt; font-family:"Times New Roman"; mso-fareast-font-family:"Times New Roman";} p.MsoListBullet2, li.MsoListBullet2, div.MsoListBullet2 {mso-style-update:auto; margin-top:0in; margin-right:0in; margin-bottom:0in; margin-left:.5in; margin-bottom:.0001pt; text-indent:-.25in; mso-pagination:widow-orphan; mso-list:l7 level1 lfo9; tab-stops:list .5in; font-size:10.0pt; font-family:"Times New Roman"; mso-fareast-font-family:"Times New Roman";} p.MsoListBullet3, li.MsoListBullet3, div.MsoListBullet3 {mso-style-update:auto; margin-top:0in; margin-right:0in; margin-bottom:0in; margin-left:.75in; margin-bottom:.0001pt; text-indent:-.25in; mso-pagination:widow-orphan; mso-list:l6 level1 lfo12; tab-stops:list .75in; font-size:10.0pt; font-family:"Times New Roman"; mso-fareast-font-family:"Times New Roman";} p.MsoListBullet4, li.MsoListBullet4, div.MsoListBullet4 {mso-style-update:auto; margin-top:0in; margin-right:0in; margin-bottom:0in; margin-left:1.0in; margin-bottom:.0001pt; text-indent:-.25in; mso-pagination:widow-orphan; mso-list:l5 level1 lfo15; tab-stops:list 1.0in; font-size:10.0pt; font-family:"Times New Roman"; mso-fareast-font-family:"Times New Roman";} p.MsoListBullet5, li.MsoListBullet5, div.MsoListBullet5 {mso-style-update:auto; margin-top:0in; margin-right:0in; margin-bottom:0in; margin-left:1.25in; margin-bottom:.0001pt; text-indent:-.25in; mso-pagination:widow-orphan; mso-list:l4 level1 lfo18; tab-stops:list 1.25in; font-size:10.0pt; font-family:"Times New Roman"; mso-fareast-font-family:"Times New Roman";} p.MsoListNumber2, li.MsoListNumber2, div.MsoListNumber2 {margin-top:0in; margin-right:0in; margin-bottom:0in; margin-left:.5in; margin-bottom:.0001pt; text-indent:-.25in; mso-pagination:widow-orphan; mso-list:l3 level1 lfo21; tab-stops:list .5in; font-size:10.0pt; font-family:"Times New Roman"; mso-fareast-font-family:"Times New Roman";} p.MsoListNumber3, li.MsoListNumber3, div.MsoListNumber3 {margin-top:0in; margin-right:0in; margin-bottom:0in; margin-left:.75in; margin-bottom:.0001pt; text-indent:-.25in; mso-pagination:widow-orphan; mso-list:l2 level1 lfo24; tab-stops:list .75in; font-size:10.0pt; font-family:"Times New Roman"; mso-fareast-font-family:"Times New Roman";} p.MsoListNumber4, li.MsoListNumber4, div.MsoListNumber4 {margin-top:0in; margin-right:0in; margin-bottom:0in; margin-left:1.0in; margin-bottom:.0001pt; text-indent:-.25in; mso-pagination:widow-orphan; mso-list:l1 level1 lfo27; tab-stops:list 1.0in; font-size:10.0pt; font-family:"Times New Roman"; mso-fareast-font-family:"Times New Roman";} p.MsoListNumber5, li.MsoListNumber5, div.MsoListNumber5 {margin-top:0in; margin-right:0in; margin-bottom:0in; margin-left:1.25in; margin-bottom:.0001pt; text-indent:-.25in; mso-pagination:widow-orphan; mso-list:l0 level1 lfo30; tab-stops:list 1.25in; font-size:10.0pt; font-family:"Times New Roman"; mso-fareast-font-family:"Times New Roman";} p.MsoTitle, li.MsoTitle, div.MsoTitle {margin-top:12.0pt; margin-right:0in; margin-bottom:3.0pt; margin-left:0in; text-align:center; mso-pagination:widow-orphan; mso-outline-level:1; font-size:16.0pt; mso-bidi-font-size:10.0pt; font-family:Arial; mso-fareast-font-family:"Times New Roman"; mso-bidi-font-family:"Times New Roman"; mso-font-kerning:14.0pt; font-weight:bold; mso-bidi-font-weight:normal;} p.MsoClosing, li.MsoClosing, div.MsoClosing {margin-top:0in; margin-right:0in; margin-bottom:0in; margin-left:3.0in; margin-bottom:.0001pt; mso-pagination:widow-orphan; font-size:10.0pt; font-family:"Times New Roman"; mso-fareast-font-family:"Times New Roman";} p.MsoSignature, li.MsoSignature, div.MsoSignature {margin-top:0in; margin-right:0in; margin-bottom:0in; margin-left:3.0in; margin-bottom:.0001pt; mso-pagination:widow-orphan; font-size:10.0pt; font-family:"Times New Roman"; mso-fareast-font-family:"Times New Roman";} p.MsoBodyText, li.MsoBodyText, div.MsoBodyText {margin:0in; margin-bottom:.0001pt; mso-pagination:widow-orphan; font-size:10.0pt; font-family:"Times New Roman"; mso-fareast-font-family:"Times New Roman"; font-weight:bold; mso-bidi-font-weight:normal;} p.MsoBodyTextIndent, li.MsoBodyTextIndent, div.MsoBodyTextIndent {margin-top:0in; margin-right:0in; margin-bottom:6.0pt; margin-left:.25in; mso-pagination:widow-orphan; font-size:10.0pt; font-family:"Times New Roman"; mso-fareast-font-family:"Times New Roman";} p.MsoListContinue, li.MsoListContinue, div.MsoListContinue {margin-top:0in; margin-right:0in; margin-bottom:6.0pt; margin-left:.25in; mso-pagination:widow-orphan; font-size:10.0pt; font-family:"Times New Roman"; mso-fareast-font-family:"Times New Roman";} p.MsoListContinue2, li.MsoListContinue2, div.MsoListContinue2 {margin-top:0in; margin-right:0in; margin-bottom:6.0pt; margin-left:.5in; mso-pagination:widow-orphan; font-size:10.0pt; font-family:"Times New Roman"; mso-fareast-font-family:"Times New Roman";} p.MsoListContinue3, li.MsoListContinue3, div.MsoListContinue3 {margin-top:0in; margin-right:0in; margin-bottom:6.0pt; margin-left:.75in; mso-pagination:widow-orphan; font-size:10.0pt; font-family:"Times New Roman"; mso-fareast-font-family:"Times New Roman";} p.MsoListContinue4, li.MsoListContinue4, div.MsoListContinue4 {margin-top:0in; margin-right:0in; margin-bottom:6.0pt; margin-left:1.0in; mso-pagination:widow-orphan; font-size:10.0pt; font-family:"Times New Roman"; mso-fareast-font-family:"Times New Roman";} p.MsoListContinue5, li.MsoListContinue5, div.MsoListContinue5 {margin-top:0in; margin-right:0in; margin-bottom:6.0pt; margin-left:1.25in; mso-pagination:widow-orphan; font-size:10.0pt; font-family:"Times New Roman"; mso-fareast-font-family:"Times New Roman";} p.MsoMessageHeader, li.MsoMessageHeader, div.MsoMessageHeader {margin-top:0in; margin-right:0in; margin-bottom:0in; margin-left:.75in; margin-bottom:.0001pt; text-indent:-.75in; mso-pagination:widow-orphan; background:#CCCCCC; mso-shading:windowtext; mso-pattern:gray-20 auto; border:none; mso-border-alt:solid windowtext .75pt; padding:0in; mso-padding-alt:1.0pt 1.0pt 1.0pt 1.0pt; font-size:12.0pt; mso-bidi-font-size:10.0pt; font-family:Arial; mso-fareast-font-family:"Times New Roman"; mso-bidi-font-family:"Times New Roman";} p.MsoSubtitle, li.MsoSubtitle, div.MsoSubtitle {margin-top:0in; margin-right:0in; margin-bottom:3.0pt; margin-left:0in; text-align:center; mso-pagination:widow-orphan; mso-outline-level:2; font-size:12.0pt; mso-bidi-font-size:10.0pt; font-family:Arial; mso-fareast-font-family:"Times New Roman"; mso-bidi-font-family:"Times New Roman";} p.MsoSalutation, li.MsoSalutation, div.MsoSalutation {mso-style-next:Normal; margin:0in; margin-bottom:.0001pt; mso-pagination:widow-orphan; font-size:10.0pt; font-family:"Times New Roman"; mso-fareast-font-family:"Times New Roman";} p.MsoDate, li.MsoDate, div.MsoDate {mso-style-next:Normal; margin:0in; margin-bottom:.0001pt; mso-pagination:widow-orphan; font-size:10.0pt; font-family:"Times New Roman"; mso-fareast-font-family:"Times New Roman";} p.MsoBodyTextFirstIndent, li.MsoBodyTextFirstIndent, div.MsoBodyTextFirstIndent {mso-style-parent:"Body Text"; margin-top:0in; margin-right:0in; margin-bottom:6.0pt; margin-left:0in; text-indent:10.5pt; mso-pagination:widow-orphan; font-size:10.0pt; font-family:"Times New Roman"; mso-fareast-font-family:"Times New Roman";} p.MsoBodyTextFirstIndent2, li.MsoBodyTextFirstIndent2, div.MsoBodyTextFirstIndent2 {mso-style-parent:"Body Text Indent"; margin-top:0in; margin-right:0in; margin-bottom:6.0pt; margin-left:.25in; text-indent:10.5pt; mso-pagination:widow-orphan; font-size:10.0pt; font-family:"Times New Roman"; mso-fareast-font-family:"Times New Roman";} p.MsoNoteHeading, li.MsoNoteHeading, div.MsoNoteHeading {mso-style-next:Normal; margin:0in; margin-bottom:.0001pt; mso-pagination:widow-orphan; font-size:10.0pt; font-family:"Times New Roman"; mso-fareast-font-family:"Times New Roman";} p.MsoBodyText2, li.MsoBodyText2, div.MsoBodyText2 {margin-top:0in; margin-right:0in; margin-bottom:6.0pt; margin-left:0in; line-height:200%; mso-pagination:widow-orphan; font-size:10.0pt; font-family:"Times New Roman"; mso-fareast-font-family:"Times New Roman";} p.MsoBodyText3, li.MsoBodyText3, div.MsoBodyText3 {margin:0in; margin-bottom:.0001pt; text-align:justify; mso-pagination:widow-orphan; font-size:12.0pt; mso-bidi-font-size:10.0pt; font-family:"Times New Roman"; mso-fareast-font-family:"Times New Roman"; font-style:italic; mso-bidi-font-style:normal;} p.MsoBodyTextIndent2, li.MsoBodyTextIndent2, div.MsoBodyTextIndent2 {margin-top:0in; margin-right:0in; margin-bottom:6.0pt; margin-left:.25in; line-height:200%; mso-pagination:widow-orphan; font-size:10.0pt; font-family:"Times New Roman"; mso-fareast-font-family:"Times New Roman";} p.MsoBodyTextIndent3, li.MsoBodyTextIndent3, div.MsoBodyTextIndent3 {margin-top:0in; margin-right:0in; margin-bottom:6.0pt; margin-left:.25in; mso-pagination:widow-orphan; font-size:8.0pt; mso-bidi-font-size:10.0pt; font-family:"Times New Roman"; mso-fareast-font-family:"Times New Roman";} p.MsoBlockText, li.MsoBlockText, div.MsoBlockText {margin-top:0in; margin-right:1.0in; margin-bottom:6.0pt; margin-left:1.0in; mso-pagination:widow-orphan; font-size:10.0pt; font-family:"Times New Roman"; mso-fareast-font-family:"Times New Roman";} a:link, span.MsoHyperlink {mso-style-parent:""; mso-ansi-font-size:12.0pt; mso-ascii-font-family:"CG Times"; mso-hansi-font-family:"CG Times"; color:blue; text-decoration:underline; text-underline:single;} a:visited, span.MsoHyperlinkFollowed {color:purple; text-decoration:underline; text-underline:single;} p.MsoDocumentMap, li.MsoDocumentMap, div.MsoDocumentMap {margin:0in; margin-bottom:.0001pt; mso-pagination:widow-orphan; background:navy; font-size:10.0pt; font-family:Tahoma; mso-fareast-font-family:"Times New Roman"; mso-bidi-font-family:"Times New Roman";} p.MsoPlainText, li.MsoPlainText, div.MsoPlainText {margin:0in; margin-bottom:.0001pt; mso-pagination:widow-orphan; font-size:10.0pt; font-family:"Courier New"; mso-fareast-font-family:"Times New Roman"; mso-bidi-font-family:"Times New Roman";} p {margin-right:0in; mso-margin-top-alt:auto; mso-margin-bottom-alt:auto; margin-left:0in; mso-pagination:widow-orphan; font-size:12.0pt; font-family:"Times New Roman"; mso-fareast-font-family:"Times New Roman";} pre {margin:0in; margin-bottom:.0001pt; mso-pagination:widow-orphan; tab-stops:45.8pt 91.6pt 137.4pt 183.2pt 229.0pt 274.8pt 320.6pt 366.4pt 412.2pt 458.0pt 503.8pt 549.6pt 595.4pt 641.2pt 687.0pt 732.8pt; font-size:10.0pt; font-family:"Courier New"; mso-fareast-font-family:"Courier New";} p.Level1, li.Level1, div.Level1 {mso-style-name:"Level 1"; margin-top:0in; margin-right:0in; margin-bottom:0in; margin-left:.25in; margin-bottom:.0001pt; text-indent:-.25in; mso-pagination:none; layout-grid-mode:char; font-size:12.0pt; mso-bidi-font-size:10.0pt; font-family:"Times New Roman"; mso-fareast-font-family:"Times New Roman";} p.H4, li.H4, div.H4 {mso-style-name:H4; mso-style-next:Normal; margin-top:5.0pt; margin-right:0in; margin-bottom:5.0pt; margin-left:0in; mso-pagination:widow-orphan; page-break-after:avoid; mso-outline-level:5; layout-grid-mode:char; font-size:12.0pt; mso-bidi-font-size:10.0pt; font-family:"Times New Roman"; mso-fareast-font-family:"Times New Roman"; font-weight:bold; mso-bidi-font-weight:normal;} span.Hypertext {mso-style-name:Hypertext; mso-style-parent:""; color:blue; text-decoration:underline; text-underline:single;} span.msochangeprop0 {mso-style-name:msochangeprop;} p.xl22, li.xl22, div.xl22 {mso-style-name:xl22; margin-right:0in; mso-margin-top-alt:auto; mso-margin-bottom-alt:auto; margin-left:0in; text-align:justify; mso-pagination:widow-orphan; background:silver; border:none; mso-border-left-alt:solid black .5pt; mso-border-bottom-alt:solid black .5pt; mso-border-right-alt:solid black .5pt; padding:0in; mso-padding-alt:0in 0in 0in 0in; font-size:12.0pt; font-family:Arial; mso-fareast-font-family:"Arial Unicode MS";} p.xl23, li.xl23, div.xl23 {mso-style-name:xl23; margin-right:0in; mso-margin-top-alt:auto; mso-margin-bottom-alt:auto; margin-left:0in; mso-pagination:widow-orphan; border:none; mso-border-left-alt:solid black .5pt; mso-border-right-alt:solid black .5pt; padding:0in; mso-padding-alt:0in 0in 0in 0in; font-size:12.0pt; font-family:Arial; mso-fareast-font-family:"Arial Unicode MS";} p.xl24, li.xl24, div.xl24 {mso-style-name:xl24; margin-right:0in; mso-margin-top-alt:auto; mso-margin-bottom-alt:auto; margin-left:0in; text-align:justify; mso-pagination:widow-orphan; border:none; mso-border-left-alt:solid black .5pt; mso-border-bottom-alt:solid black .5pt; mso-border-right-alt:solid black .5pt; padding:0in; mso-padding-alt:0in 0in 0in 0in; font-size:12.0pt; font-family:Arial; mso-fareast-font-family:"Arial Unicode MS";} p.xl25, li.xl25, div.xl25 {mso-style-name:xl25; margin-right:0in; mso-margin-top-alt:auto; mso-margin-bottom-alt:auto; margin-left:0in; mso-pagination:widow-orphan; border:none; mso-border-left-alt:solid black .5pt; mso-border-bottom-alt:solid black .5pt; mso-border-right-alt:solid black .5pt; padding:0in; mso-padding-alt:0in 0in 0in 0in; font-size:12.0pt; font-family:Arial; mso-fareast-font-family:"Arial Unicode MS";} p.xl26, li.xl26, div.xl26 {mso-style-name:xl26; margin-right:0in; mso-margin-top-alt:auto; mso-margin-bottom-alt:auto; margin-left:0in; mso-pagination:widow-orphan; background:silver; border:none; mso-border-left-alt:solid black .5pt; mso-border-bottom-alt:solid black .5pt; mso-border-right-alt:solid black .5pt; padding:0in; mso-padding-alt:0in 0in 0in 0in; font-size:12.0pt; font-family:Arial; mso-fareast-font-family:"Arial Unicode MS";} p.xl27, li.xl27, div.xl27 {mso-style-name:xl27; margin-right:0in; mso-margin-top-alt:auto; mso-margin-bottom-alt:auto; margin-left:0in; text-align:right; mso-pagination:widow-orphan; border:none; mso-border-left-alt:solid black .5pt; mso-border-bottom-alt:solid black .5pt; mso-border-right-alt:solid black .5pt; padding:0in; mso-padding-alt:0in 0in 0in 0in; font-size:12.0pt; font-family:Arial; mso-fareast-font-family:"Arial Unicode MS";} p.xl28, li.xl28, div.xl28 {mso-style-name:xl28; margin-right:0in; mso-margin-top-alt:auto; mso-margin-bottom-alt:auto; margin-left:0in; text-align:right; mso-pagination:widow-orphan; background:silver; border:none; mso-border-left-alt:solid black .5pt; mso-border-bottom-alt:solid black .5pt; mso-border-right-alt:solid black .5pt; padding:0in; mso-padding-alt:0in 0in 0in 0in; font-size:12.0pt; font-family:Arial; mso-fareast-font-family:"Arial Unicode MS";} p.xl29, li.xl29, div.xl29 {mso-style-name:xl29; margin-right:0in; mso-margin-top-alt:auto; mso-margin-bottom-alt:auto; margin-left:0in; text-align:right; mso-pagination:widow-orphan; border:none; mso-border-right-alt:solid black .5pt; padding:0in; mso-padding-alt:0in 0in 0in 0in; font-size:12.0pt; font-family:Arial; mso-fareast-font-family:"Arial Unicode MS";} p.xl30, li.xl30, div.xl30 {mso-style-name:xl30; margin-right:0in; mso-margin-top-alt:auto; mso-margin-bottom-alt:auto; margin-left:0in; text-align:center; mso-pagination:widow-orphan; border:none; mso-border-bottom-alt:solid black .5pt; mso-border-right-alt:solid black .5pt; padding:0in; mso-padding-alt:0in 0in 0in 0in; font-size:12.0pt; font-family:Arial; mso-fareast-font-family:"Arial Unicode MS";} p.xl31, li.xl31, div.xl31 {mso-style-name:xl31; margin-right:0in; mso-margin-top-alt:auto; mso-margin-bottom-alt:auto; margin-left:0in; text-align:right; mso-pagination:widow-orphan; border:none; mso-border-bottom-alt:solid black .5pt; mso-border-right-alt:solid black .5pt; padding:0in; mso-padding-alt:0in 0in 0in 0in; font-size:12.0pt; font-family:Arial; mso-fareast-font-family:"Arial Unicode MS";} p.xl32, li.xl32, div.xl32 {mso-style-name:xl32; margin-right:0in; mso-margin-top-alt:auto; mso-margin-bottom-alt:auto; margin-left:0in; text-align:right; mso-pagination:widow-orphan; border:none; mso-border-bottom-alt:solid black .5pt; mso-border-right-alt:solid black .5pt; padding:0in; mso-padding-alt:0in 0in 0in 0in; font-size:12.0pt; font-family:Arial; mso-fareast-font-family:"Arial Unicode MS";} p.xl33, li.xl33, div.xl33 {mso-style-name:xl33; margin-right:0in; mso-margin-top-alt:auto; mso-margin-bottom-alt:auto; margin-left:0in; text-align:right; mso-pagination:widow-orphan; border:none; mso-border-left-alt:solid black .5pt; mso-border-bottom-alt:solid black .5pt; mso-border-right-alt:solid black .5pt; padding:0in; mso-padding-alt:0in 0in 0in 0in; font-size:12.0pt; font-family:Arial; mso-fareast-font-family:"Arial Unicode MS";} p.xl34, li.xl34, div.xl34 {mso-style-name:xl34; margin-right:0in; mso-margin-top-alt:auto; mso-margin-bottom-alt:auto; margin-left:0in; mso-pagination:widow-orphan; border:none; mso-border-alt:solid black .5pt; mso-border-bottom-alt:solid white .5pt; padding:0in; mso-padding-alt:0in 0in 0in 0in; font-size:12.0pt; font-family:"Times New Roman"; mso-fareast-font-family:"Arial Unicode MS";} p.xl35, li.xl35, div.xl35 {mso-style-name:xl35; margin-right:0in; mso-margin-top-alt:auto; mso-margin-bottom-alt:auto; margin-left:0in; mso-pagination:widow-orphan; border:none; mso-border-top-alt:solid black .5pt; mso-border-bottom-alt:solid black .5pt; padding:0in; mso-padding-alt:0in 0in 0in 0in; font-size:12.0pt; font-family:Arial; mso-fareast-font-family:"Arial Unicode MS"; font-weight:bold;} p.xl36, li.xl36, div.xl36 {mso-style-name:xl36; margin-right:0in; mso-margin-top-alt:auto; mso-margin-bottom-alt:auto; margin-left:0in; mso-pagination:widow-orphan; border:none; mso-border-top-alt:solid black .5pt; mso-border-bottom-alt:solid black .5pt; padding:0in; mso-padding-alt:0in 0in 0in 0in; font-size:12.0pt; font-family:"Arial Unicode MS";} p.xl37, li.xl37, div.xl37 {mso-style-name:xl37; margin-right:0in; mso-margin-top-alt:auto; mso-margin-bottom-alt:auto; margin-left:0in; mso-pagination:widow-orphan; border:none; mso-border-top-alt:solid black .5pt; mso-border-bottom-alt:solid black .5pt; mso-border-right-alt:solid black .5pt; padding:0in; mso-padding-alt:0in 0in 0in 0in; font-size:12.0pt; font-family:"Arial Unicode MS";} p.xl38, li.xl38, div.xl38 {mso-style-name:xl38; margin-right:0in; mso-margin-top-alt:auto; mso-margin-bottom-alt:auto; margin-left:0in; text-align:center; mso-pagination:widow-orphan; border:none; mso-border-top-alt:solid black .5pt; mso-border-left-alt:solid black .5pt; mso-border-bottom-alt:solid black .5pt; padding:0in; mso-padding-alt:0in 0in 0in 0in; font-size:12.0pt; font-family:Arial; mso-fareast-font-family:"Arial Unicode MS"; font-weight:bold;} p.xl39, li.xl39, div.xl39 {mso-style-name:xl39; margin-right:0in; mso-margin-top-alt:auto; mso-margin-bottom-alt:auto; margin-left:0in; text-align:center; mso-pagination:widow-orphan; border:none; mso-border-top-alt:solid black .5pt; mso-border-bottom-alt:solid black .5pt; padding:0in; mso-padding-alt:0in 0in 0in 0in; font-size:12.0pt; font-family:Arial; mso-fareast-font-family:"Arial Unicode MS"; font-weight:bold;} p.xl40, li.xl40, div.xl40 {mso-style-name:xl40; margin-right:0in; mso-margin-top-alt:auto; mso-margin-bottom-alt:auto; margin-left:0in; text-align:center; mso-pagination:widow-orphan; border:none; mso-border-top-alt:solid black .5pt; mso-border-bottom-alt:solid black .5pt; mso-border-right-alt:solid black .5pt; padding:0in; mso-padding-alt:0in 0in 0in 0in; font-size:12.0pt; font-family:Arial; mso-fareast-font-family:"Arial Unicode MS"; font-weight:bold;} p.xl41, li.xl41, div.xl41 {mso-style-name:xl41; margin-right:0in; mso-margin-top-alt:auto; mso-margin-bottom-alt:auto; margin-left:0in; mso-pagination:widow-orphan; border:none; mso-border-top-alt:solid black .5pt; mso-border-bottom-alt:solid black .5pt; mso-border-right-alt:solid black .5pt; padding:0in; mso-padding-alt:0in 0in 0in 0in; font-size:12.0pt; font-family:Arial; mso-fareast-font-family:"Arial Unicode MS"; font-weight:bold;} @page Section1 {size:8.5in 11.0in; margin:.5in .5in .5in 1.0in; mso-header-margin:.3in; mso-footer-margin:.3in; mso-paper-source:0;} div.Section1 {page:Section1;} /* List Definitions */ @list l0 {mso-list-id:-132; mso-list-type:simple; mso-list-template-ids:1577326330;} @list l0:level1 {mso-level-style-link:"List Number 5"; mso-level-tab-stop:1.25in; mso-level-number-position:left; margin-left:1.25in; text-indent:-.25in;} @list l1 {mso-list-id:-131; mso-list-type:simple; mso-list-template-ids:-658069850;} @list l1:level1 {mso-level-style-link:"List Number 4"; mso-level-tab-stop:1.0in; mso-level-number-position:left; margin-left:1.0in; text-indent:-.25in;} @list l2 {mso-list-id:-130; mso-list-type:simple; mso-list-template-ids:-1300835844;} @list l2:level1 {mso-level-style-link:"List Number 3"; mso-level-tab-stop:.75in; mso-level-number-position:left; margin-left:.75in; text-indent:-.25in;} @list l3 {mso-list-id:-129; mso-list-type:simple; mso-list-template-ids:1559763810;} @list l3:level1 {mso-level-style-link:"List Number 2"; mso-level-tab-stop:.5in; mso-level-number-position:left; text-indent:-.25in;} @list l4 {mso-list-id:-128; mso-list-type:simple; mso-list-template-ids:-1294583006;} @list l4:level1 {mso-level-number-format:bullet; mso-level-style-link:"List Bullet 5"; mso-level-text:\F0B7; mso-level-tab-stop:1.25in; mso-level-number-position:left; margin-left:1.25in; text-indent:-.25in; font-family:Symbol;} @list l5 {mso-list-id:-127; mso-list-type:simple; mso-list-template-ids:-213093490;} @list l5:level1 {mso-level-number-format:bullet; mso-level-style-link:"List Bullet 4"; mso-level-text:\F0B7; mso-level-tab-stop:1.0in; mso-level-number-position:left; margin-left:1.0in; text-indent:-.25in; font-family:Symbol;} @list l6 {mso-list-id:-126; mso-list-type:simple; mso-list-template-ids:-1706154988;} @list l6:level1 {mso-level-number-format:bullet; mso-level-style-link:"List Bullet 3"; mso-level-text:\F0B7; mso-level-tab-stop:.75in; mso-level-number-position:left; margin-left:.75in; text-indent:-.25in; font-family:Symbol;} @list l7 {mso-list-id:-125; mso-list-type:simple; mso-list-template-ids:465180584;} @list l7:level1 {mso-level-number-format:bullet; mso-level-style-link:"List Bullet 2"; mso-level-text:\F0B7; mso-level-tab-stop:.5in; mso-level-number-position:left; text-indent:-.25in; font-family:Symbol;} @list l8 {mso-list-id:-120; mso-list-type:simple; mso-list-template-ids:-145737008;} @list l8:level1 {mso-level-style-link:"List Number"; mso-level-tab-stop:.25in; mso-level-number-position:left; margin-left:.25in; text-indent:-.25in;} @list l9 {mso-list-id:-119; mso-list-type:simple; mso-list-template-ids:-769752982;} @list l9:level1 {mso-level-number-format:bullet; mso-level-style-link:"List Bullet"; mso-level-text:\F0B7; mso-level-tab-stop:.25in; mso-level-number-position:left; margin-left:.25in; text-indent:-.25in; font-family:Symbol;} @list l10 {mso-list-id:1858079306; mso-list-type:hybrid; mso-list-template-ids:-348380412 67698689 67698691 67698693 67698689 67698691 67698693 67698689 67698691 67698693;} @list l10:level1 {mso-level-number-format:bullet; mso-level-text:\F0B7; mso-level-tab-stop:1.0in; mso-level-number-position:left; margin-left:1.0in; text-indent:-.25in; font-family:Symbol;} ol {margin-bottom:0in;} ul {margin-bottom:0in;} --> Overview: Thursday, September 12, 2002 (next release 2:00 p.m. on September 19) Natural gas spot prices have moved up by 10 to 25 cents at most trading locations since Wednesday, September 4. For the week (Wednesday-Wednesday), the average Henry Hub price climbed $0.20 per MMBtu to $3.32 as Tropical Storm Fay temporarily threatened Gulf area production activity and late-season high temperatures triggered cooling demand in key market areas. The price of the NYMEX futures contract for October delivery at the Henry Hub increased a more moderate $0.057 per MMBtu since last Wednesday to settle at $3.250 yesterday. Natural gas in storage increased to 2,855 Bcf, which exceeds the 5-year average by nearly 12.3 percent. The spot price for West Texas Intermediate (WTI) crude oil rose $1.49 per barrel to $29.77, or $5.13 per MMBtu. Prices: Spot prices this week (Wednesday-Wednesday) recovered much of the previous weeks losses as hot weather returned to many regions and Tropical Storm Fay stirred fears of possible production shut-ins. The Henry Hub spot price climbed 19 cents to an average of $3.38 per MMBtu last Friday, the highest price at the hub for the week, as Tropical Storm Fay threatened production fields near Galveston, Texas. However, Fays strength diminished by the next day, and few producers reported shutting in production, according to the Minerals Management Service. Adding to the cash markets strength, hot weather returned to both coasts as temperatures this weekend hit the 90s in parts of California and in New York. For the week, the spot price at the Southern California border gained 20 cents to an average of $3.11 per MMBtu yesterday (Wednesday, September 11). The spot price at the New York citygate climbed $0.16 per MMBtu to an average of $3.60. Rockies prices suffered yet another downturn this week as infrastructure maintenance limited outlets for supplies. Before a mild recovery yesterday, the spot price in Opal, Wyoming, dropped to as low as 67 cents per MMBtu earlier this week. The regions oversupply was compounded by Questars directive that all holders of interruptible storage would have to empty their supplies from the Clay Basin storage facility because of high storage inventories. Prices at the Questar trading point dropped to an average of 55 cents per MMBtu on Tuesday. Prices on El Paso Natural Gas in the Southwest plummeted on the week as supplies were diverted to the pipeline owing to maintenance on Transwestern Pipeline. On the week, the El Paso non-Bondad trading point in New Mexico suffered the biggest decline, falling 46 cents to $2.16 per MMBtu. At the NYMEX, the price of the futures contract for October delivery at the Henry Hub increased $0.057 per MMBtu on the week to a close of $3.250 yesterday. The near-month contract this week benefited from fears of slowing production and strong prices for crude oil, which rose to near $30 this week owing to reports of relatively low U.S. oil stocks. Concerns over a possible U.S. invasion of Iraq and the renewed fears of terrorism also appeared to contribute to strength in oil prices, which have increased by $2.01 per barrel since the beginning of the month. After a delayed opening yesterday in recognition of the September 11 anniversary ceremonies, the October contract yesterday recorded a loss in value of slightly less than 11 cents per MMBtu. The futures contract for November closed at $3.645 per MMBtu, down 8.9 cents on the day. The 12-month strip, which is the average cost for futures contracts over the next year, moved down 6.4 cents to $3.796 per MMBtu. Storage: Working gas in storage was 2,855 Bcf or 12.3 percent above the 5-year average for the week ending September 6, according to EIAs Weekly Natural Gas Storage Report. (See Storage Figure) With temperatures in many areas of the country much hotter than last year as measured by cooling degree days (CDDs), the implied net injection for the week was 74 Bcf, which is 4.2 percent higher than the 5-year average injection for the week of 71 Bcf. CDDs were 20 percent higher than the comparable week last year for the country as a whole, but almost double in the Upper Plains region for the week ending September 7. (See Temperature Map) (See Deviation Map) With summer heat dissipating, the industry has historically boosted injections during September. Storage stocks are 183 Bcf higher than a year ago and 313 Bcf higher than the 5-year average for the week. Other Market Trends: FERC Proposes Plan To Protect Critical Energy Infrastructure Information: After examining the issue for nearly a year in the wake of the terrorist attacks of September 11, 2001, the Federal Energy Regulatory Commission (FERC) last week proposed to establish regulations that would limit access to information about the nations energy infrastructure. In its Notice of Proposed Rulemaking (NOPR), FERC defines critical energy infrastructure information (CEII) as information about proposed or existing critical infrastructure that: relates to the production, generation, transportation, transmission, or distribution of energy could be useful to a person in planning an attack on critical infrastructure is exempt from mandatory disclosure under the Freedom of Information Act gives strategic information beyond the location of the critical infrastructure. The NOPR proposes procedures for requesting confidential treatment of CEII, and sets forth a method for handling challenges to the designation of certain information as CEII. The stated overall objective is to protect information designated sensitive, while still allowing efficient access to such information by those with a valid need to know. In many cases the CEII designation will require the removal of certain information from the public domain. Natural Gas Summary from the Short-Term Energy Outlook: EIA projects that natural gas wellhead prices will range between $2.71 and $2.75 per MMBtu through October and then increase to $2.92 in November as the heating season gets underway (Short-Term Energy Outlook, September 2002). Prices remained above $2.90 during the last half of August as unusually hot weather across the nation resulted in added cooling demand, placing upward pressure on prices. Now that the summer is nearly over, cooling demand should be tapering off, while at the same time, the heating season has not yet begun. Overall in 2002, wellhead prices are expected to average about $2.73 per MMBtu compared with $4.00 in 2001. Prices during the upcoming heating season (November through March), assuming normal weather, are expected to average $3.20 per MMBtu, which is about $0.84 higher than last winters price. Domestic dry natural gas production is projected to fall by about 1.7 percent in 2002 compared with the 2001 growth rate of 2.4 percent. Lower natural gas prices have reduced production and resource development incentives from their highs of last year. Still, current supplies, including natural gas in storage, appear to be at very comfortable levels. Working gas in storage has exceeded the highest levels recorded in the previous 5 years since the beginning of the year. By the end of August, working gas storage stocks were about 2,781 Bcf, which is 12.5 percent above the 5-year average and 205 Bcf higher than a year ago. Moreover, natural gas-directed drilling, while down from the record levels of mid 2001, is still quite strong by a longer historical perspective. The gas rig count as of August 30, 2002, was 741, which is 25 percent above the recent low of 591 for the week of April 5, 2002. In 2003, production is expected to rebound by 3.2 percent as demand rises and inventories fall back closer to normal Natural gas demand is expected to increase sharply in November and December and early 2003 because of the expected continuation of solid recovery in the U.S. industrial economy by the fourth quarter of this year and the return of colder weather. The expected increase in natural gas demand for the coming winter, assuming normal weather, is 12 percent above the year-ago level. Natural gas demand for the entire year 2002 is projected to increase by 3.3 percent over 2001 levels in large part because of increased demand for natural gas for power generation. In 2003, natural gas demand growth is expected to increase by 3.6 percent, as the economy continues to recover. Natural gas demand growth is expected across all sectors, with the exception of the electric utility sector. This is because of the still ongoing transfer of ownership of electric power plants from utilities to independent power producers (included in the industrial sector) that stems from deregulation. Source: Energy Information Administration, Short-Term Energy Outlook, September 2002.
A2: http://tonto.eia.doe.gov/oog/info/ngw/ngupdate.asp
A4: Need Help? phone: 202-586-8800 email: infoctr@eia.doe.gov Specialized Services from NEIC
A5: For Technical Problems phone: 202-586-8959 email: wmaster@eia.doe.gov
A6: Energy Information Administration, EI 30
A7: 1000 Independence Avenue, SW
A8: Washington, DC 20585
A9: .
A10: Home | Petroleum | Gasoline | Diesel | Propane | Natural Gas | Electricity | Coal | Nuclear
A11: Renewables | Alternative Fuels | Prices | States | International | Country Analysis Briefs
A12: Environment | Analyses | Forecasts | Processes | Sectors

A1: Spot Prices ($ per MMBtu) | B1: Thur. | C1: Fri. | D1: Mon. | E1: Tues. | F1: Wed.
B2: 37504 | C2: 37505 | D2: 37508 | E2: 37507 | F2: 37508
A3: Henry Hub | B3: 3.19 | C3: 3.38 | D3: 3.24 | E3: 3.35 | F3: 3.32
A4: New York | B4: 3.50 | C4: 3.75 | D4: 3.62 | E4: 3.62 | F4: 3.60
A5: Chicago | B5: 3.20 | C5: 3.40 | D5: 3.23 | E5: 3.36 | F5: 3.35
A6: Cal. Comp. Avg,* | B6: 2.96 | C6: 3.0733333333333337 | D6: 2.9833333333333329 | E6: 3.1166666666666667 | F6: 3.1266666666666665
A7: Futures ($/MMBtu)
A8: Oct delivery | B8: 3.3420000000000001 | C8: 3.2650000000000001 | D8: 3.399 | E8: 3.3559999999999999 | F8: 3.250
A9: Nov delivery | B9: 3.6539999999999999 | C9: 3.605 | D9: 3.7440000000000002 | E9: 3.734 | F9: 3.645
A10: *Avg. of NGI's reported avg. prices for: Malin, PG&E citygate,
A11: and Southern California Border Avg.
A12: Source: NGI's Daily Gas Price Index (http://intelligencepress.com).

A1: All Volumes in Bcf | B1: Current Stocks 9/6//2002 | C1: Estimated Prior 5-Year (1997-2001) Average | D1: Percent Difference from 5 Year Average | E1: Implied Net Change from Last Week | F1: One-Week Prior Stocks 8/30/02
A2: East Region | B2: 1642 | C2: 1546 | D2: 6.2E-2 | E2: 52 | F2: 1590
A3: West Region | B3: 390 | C3: 324 | D3: 0.20399999999999999 | E3: 9 | F3: 381
A4: Producing Region | B4: 823 | C4: 671 | D4: 0.22700000000000001 | E4: 13 | F4: 810
A5: Total Lower 48 | B5: 2855 | C5: 2542 | D5: 0.123 | E5: 74 | F5: 2781
A6: Source: Energy Information Administration: Form EIA-912, "Weekly Underground Natural Gas Storage Report," and the Historical Weekly Storage Estimates Database.

A1: Monthly Natural Gas Market Summary
B2: History | E2: Projections
B3: 37408 | C3: 37438 | D3: 37469 | E3: 37500 | F3: 37530 | G3: 37561
A4: PRICES ($/MMBtu)
A5: Average Wellhead Price | B5: 2.8821811100292116 | C5: 2.8140214216163586 | D5: 2.7443281402142166 | E5: 2.7051110029211296 | F5: 2.7461596884128534 | G5: 2.9245813047711784
A6: Residential Price | B6: 8.7974011684518025 | C6: 9.2282775073028258 | D6: 9.4296553067185975 | E6: 9.0689532619279465 | F6: 8.0857604673807213 | G6: 7.4444391431353463
A7: Electric Utilities Price | B7: 3.2580040000000001 | C7: 3.0180479999999998 | D7: 2.8896169999999999 | E7: 2.815067 | F7: 2.924671 | G7: 3.2514639999999999
A9: SUPPLY (Trillion Cubic Feet)
A10: Total Dry Gas Prod | B10: 1.5538404000000001 | C10: 1.5975539999999999 | D10: 1.5949453499999999 | E10: 1.5417000000000001 | F10: 1.5990110000000002 | G10: 1.5749403
A11: Net Imports | B11: 0.24989821899999998 | C11: 0.27692393000000004 | D11: 0.28437257899999996 | E11: 0.26538930000000005 | F11: 0.27912124100000002 | G11: 0.27136838999999996
A12: Imports | B12: 0.28915721300000002 | C12: 0.32014196 | D12: 0.33075791000000004 | E12: 0.31250759999999994 | F12: 0.3272391 | G12: 0.31831619999999999
A13: Exports | B13: 3.9258993999999998E-2 | C13: 4.3217968000000002E-2 | D13: 4.6385331000000002E-2 | E13: 4.7118179999999996E-2 | F13: 4.8117982999999996E-2 | G13: 4.6947899999999994E-2
A14: Suppl. Gaseous Fuels | B14: 5.3037757782800005E-3 | C14: 6.2197501000000009E-3 | D14: 6.2731476E-3 | E14: 6.0375450000000001E-3 | F14: 6.135575800000001E-3 | G14: 7.1532449999999999E-3
A15: Total New Supply | B15: =+SUM(B10,B11,B14) -> 1.8090423947782801 | C15: =+SUM(C10,C11,C14) -> 1.8806976800999999 | D15: =+SUM(D10,D11,D14) -> 1.8855910765999999 | E15: =+SUM(E10,E11,E14) -> 1.8131268450000002 | F15: =+SUM(F10,F11,F14) -> 1.8842678168000002 | G15: =+SUM(G10,G11,G14) -> 1.8534619349999999
A17: Working Gas in Storage
A18: Opening | B18: 1.9681250529999998 | C18: 2.308174782 | D18: 2.5575714285714284 | E18: 2.774 | F18: 3.0569999999999999 | G18: 3.220
A19: Closing | B19: 2.308174782 | C19: 2.5575714285714284 | D19: 2.774 | E19: 3.0569999999999999 | F19: 3.220 | G19: 3.069
A20: Net Storage Withdrawal | B20: =+B18-B19 -> -0.34004972900000019 | C20: =+C18-C19 -> -0.24939664657142835 | D20: =+D18-D19 -> -0.21642857142857164 | E20: =+E18-E19 -> -0.28299999999999992 | F20: =+F18-F19 -> -0.16300000000000026 | G20: =+G18-G19 -> 0.15100000000000025
A22: Total Supply | B22: =+B15+B20 -> 1.4689926657782799 | C22: =+C15+C20 -> 1.6313010335285716 | D22: =+D15+D20 -> 1.6691625051714283 | E22: =+E15+E20 -> 1.5301268450000003 | F22: =+F15+F20 -> 1.7212678168 | G22: =+G15+G20 -> 2.0044619350000001
A24: Balancing Item | B24: =B26-B22 -> 2.3829144221720222E-2 | C24: 1.9509053299999999E-2 | D24: =D26-D22 -> 2.4882125828571633E-2 | E24: 4.8577530000000001E-2 | F24: -7.4763505999999993E-2 | G24: -8.0445599999999992E-2
A26: Total Primary Supply | B26: =B36 -> 1.4928218100000001 | C26: =+C22+C24 -> 1.6508100868285716 | D26: =D36 -> 1.6940446309999999 | E26: =+E22+E24 -> 1.5787043750000003 | F26: =+F22+F24 -> 1.6465043107999999 | G26: =+G22+G24 -> 1.9240163350000001
A28: DEMAND (Trillion Cubic Feet)
A29: Lease & Plant Fuel | B29: 9.7045350000000002E-2 | C29: 0.102038267 | D29: 0.104406822 | E29: 0.10316612999999999 | F29: 0.10720974900000001 | G29: 0.10540224000000001
A30: Pipeline Use | B30: 3.4350149999999996E-2 | C30: 3.6873539000000004E-2 | D30: 3.7557554E-2 | E30: 3.4619339999999998E-2 | F30: 3.9268195999999998E-2 | G30: 4.9614239999999997E-2
A31: Delivered to Consumers | B31: =+SUM(B32:B35) -> 1.3614263100000001 | C31: =+SUM(C32:C35) -> 1.51211056 | D31: =+SUM(D32:D35) -> 1.5520802549999999 | E31: =+SUM(E32:E35) -> 1.44091905 | F31: =+SUM(F32:F35) -> 1.5000265429999999 | G31: =+SUM(G32:G35) -> 1.76899998
A32: Residential | B32: 0.17454192000000002 | C32: 0.14512935200000002 | D32: 0.136196764 | E32: 0.15139490999999999 | F32: 0.224332647 | G32: 0.44907839999999999
A33: Commercial | B33: 0.15465039000000003 | C33: 0.151881028 | D33: 0.15037142100000001 | E33: 0.15155481000000001 | F33: 0.19486947199999999 | G33: 0.28623146999999999
A34: Industrial | B34: 0.76808969999999999 | C34: 0.86704985000000001 | D34: 0.92516090000000006 | E34: 0.89514329999999998 | F34: 0.89630827000000002 | G34: 0.89367150000000006
A35: Elec Utility | B35: 0.2641443 | C35: 0.34805032999999996 | D35: 0.34035117000000004 | E35: 0.24282603 | F35: 0.18451615399999999 | G35: 0.14001860999999999
A36: Total Demand | B36: =+B31+B30+B29 -> 1.4928218100000001 | C36: =+C31+C30+C29 -> 1.6510223659999999 | D36: =+D31+D30+D29 -> 1.6940446309999999 | E36: =+E31+E30+E29 -> 1.5787045200000001 | F36: =+F31+F30+F29 -> 1.6465044879999999 | G36: =+G31+G30+G29 -> 1.92401646