B3: Monthly Actual Data | I3: Monthly EIA 191 Survey Data
A4: Month | B4: 1995 | C4: 1996 | D4: 1997 | E4: 1998 | F4: 1999 | G4: 2000 | I4: 2001 | L4: 6-Year High (1995-2000) | M4: 6-Year Low (1995-2000) | N4: Difference
A5: January | B5: 2045 | C5: 1462.468304 | D5: 1495.563116 | E5: 1712 | F5: 2094 | G5: 1724.6516630000001 | I5: 1265 | J5: 35826 | K5: 1712 | L5: 2094 | M5: 1462 | N5: =L5-M5 -> 632
A6: February | B6: 1542 | C6: 1020.58242 | D6: 1139.4220359999999 | E6: 1426 | F6: 1792 | G6: 1300.4144570000001 | I6: 912 | J6: 35854 | K6: 1426 | L6: 1792 | M6: 1021 | N6: =L6-M6 -> 771
A7: March | B7: 1332 | C7: 757.994642 | D7: 990.43301299999996 | E7: 1183 | F7: 1430 | G7: 1149.9492420000001 | I7: 742 | J7: 35885 | K7: 1183 | L7: 1430 | M7: 758 | N7: =L7-M7 -> 672
A8: April | B8: 1379 | C8: 853.96110799999997 | D8: 1051.234753 | E8: 1386 | F8: 1514 | G8: 1184.3404459999999 | I8: 992 | J8: 35915 | K8: 1386 | L8: 1514 | M8: 854 | N8: =L8-M8 -> 660
A9: May | B9: 1668 | C9: 1161.114546 | D9: 1364.797456 | E9: 1774 | F9: 1847 | G9: 1426.4080000000001 | I9: 1440 | J9: 35946 | K9: 1774 | L9: 1847 | M9: 1161 | N9: =L9-M9 -> 686
A10: June | B10: 2014 | C10: 1529.1247699999999 | D10: 1731.1334360000001 | E10: 2114 | F10: 2157 | G10: 1706.3 | J10: 35976 | K10: 2114 | L10: 2157 | M10: 1529 | N10: =L10-M10 -> 628
A11: July | B11: 2301 | C11: 1897.649343 | D11: 2016.5366449999999 | E11: 2428 | F11: 2390 | G11: 1996 | J11: 36007 | K11: 2428 | L11: 2428 | M11: 1898 | N11: =L11-M11 -> 530
A12: August | B12: 2495 | C12: 2244.504117 | D12: 2337.911615 | E12: 2698 | F12: 2632 | G12: 2190 | J12: 36038 | K12: 2698 | L12: 2698 | M12: 2190 | N12: =L12-M12 -> 508
A13: September | B13: 2802 | C13: 2604.9810189999998 | D13: 2672.3088520000001 | E13: 2928 | F13: 2884 | G13: 2473 | J13: 36068 | K13: 2928 | L13: 2928 | M13: 2473 | N13: =L13-M13 -> 455
A14: October | B14: 2996 | C14: 2810.4756400000001 | D14: 2885.777419 | E14: 3191 | F14: 3026 | G14: 2699 | J14: 36099 | K14: 3191 | L14: 3191 | M14: 2699 | N14: =L14-M14 -> 492
A15: November | B15: 2728 | C15: 2549.1373570000001 | D15: 2698.8862260000001 | E15: 3155 | F15: 2991 | G15: 2443 | J15: 36129 | K15: 3155 | L15: 3155 | M15: 2443 | N15: =L15-M15 -> 712
A16: December | B16: 2153 | C16: 2172.5511759999999 | D16: 2174.5195359999998 | E16: 2730 | F16: 2509 | G16: 1720 | J16: 36160 | K16: 2730 | L16: 2730 | M16: 1720 | N16: =L16-M16 -> 1010
J17: 36191 | K17: 2094 | L17: 2094 | M17: 1462 | N17: =L17-M17 -> 632
J18: 36219 | K18: 1792 | L18: 1792 | M18: 1021 | N18: =L18-M18 -> 771
J19: 36250 | K19: 1430 | L19: 1430 | M19: 758 | N19: =L19-M19 -> 672
J20: 36280 | K20: 1514 | L20: 1514 | M20: 854 | N20: =L20-M20 -> 660
J21: 36311 | K21: 1847 | L21: 1847 | M21: 1161 | N21: =L21-M21 -> 686
J22: 36341 | K22: 2157 | L22: 2157 | M22: 1529 | N22: =L22-M22 -> 628
J23: 36372 | K23: 2390 | L23: 2428 | M23: 1898 | N23: =L23-M23 -> 530
J24: 36403 | K24: 2632 | L24: 2698 | M24: 2190 | N24: =L24-M24 -> 508
J25: 36433 | K25: 2884 | L25: 2928 | M25: 2473 | N25: =L25-M25 -> 455
J26: 36464 | K26: 3026 | L26: 3191 | M26: 2699 | N26: =L26-M26 -> 492
J27: 36494 | K27: 2991 | L27: 3155 | M27: 2443 | N27: =L27-M27 -> 712
J28: 36525 | K28: 2509 | L28: 2730 | M28: 1720 | N28: =L28-M28 -> 1010
J29: 36556 | K29: 1724.6516630000001 | L29: 2094 | M29: 1462 | N29: =L29-M29 -> 632
J30: 36585 | K30: 1300.4144570000001 | L30: 1792 | M30: 1021 | N30: =L30-M30 -> 771
J31: 36616 | K31: 1149.9492420000001 | L31: 1430 | M31: 758 | N31: =L31-M31 -> 672
J32: 36646 | K32: 1184.3404459999999 | L32: 1514 | M32: 854 | N32: =L32-M32 -> 660
J33: 36677 | K33: 1426.4080000000001 | L33: 1847 | M33: 1161 | N33: =L33-M33 -> 686
J34: 36707 | K34: 1706.3 | L34: 2157 | M34: 1529 | N34: =L34-M34 -> 628
J35: 36738 | K35: 1996 | L35: 2428 | M35: 1898 | N35: =L35-M35 -> 530
J36: 36769 | K36: 2190 | L36: 2698 | M36: 2190 | N36: =L36-M36 -> 508
J37: 36799 | K37: 2473 | L37: 2928 | M37: 2473 | N37: =L37-M37 -> 455
J38: 36830 | K38: 2699 | L38: 3191 | M38: 2699 | N38: =L38-M38 -> 492
J39: 36860 | K39: 2443 | L39: 3155 | M39: 2443 | N39: =L39-M39 -> 712
J40: 36891 | K40: 1720 | L40: 2730 | M40: 1720 | N40: =L40-M40 -> 1010
J41: 36922 | K41: 1265 | L41: 2094 | M41: 1462 | N41: =L41-M41 -> 632
J42: 36950 | K42: 912 | L42: 1792 | M42: 1021 | N42: =L42-M42 -> 771
J43: 36981 | K43: 742 | L43: 1430 | M43: 758 | N43: =L43-M43 -> 672
J44: 37011 | K44: 992 | L44: 1514 | M44: 854 | N44: =L44-M44 -> 660
K45: =+'\\Fs-f1\L6023\weekly\[ng storage_1995 on.xls]Inventory Estimate'!$F$61 -> 1053.7142857142858 | L45: =3*(L$32-L$31)/30+4*(L$33-L$32)/31+L44 -> 1565.3677419354838 | M45: =3*(M$32-M$31)/30+4*(M$33-M$32)/31+M44 -> 903.21290322580649 | N45: =L45-M45 -> 662.15483870967728
J46: 37022 | K46: =+'\\Fs-f1\L6023\weekly\[ng storage_1995 on.xls]Inventory Estimate'!$F$62 -> 1159.7142857142858 | L46: =7*(L$33-L$32)/31+L45 -> 1640.5612903225806 | M46: =7*(M$33-M$32)/31+M45 -> 972.53548387096782 | N46: =L46-M46 -> 668.02580645161277
J47: 37029 | K47: =+'\\Fs-f1\L6023\weekly\[ng storage_1995 on.xls]Inventory Estimate'!$F$63 -> 1277.7142857142858 | L47: =7*(L$33-L$32)/31+L46 -> 1715.7548387096774 | M47: =7*(M$33-M$32)/31+M46 -> 1041.8580645161292 | N47: =L47-M47 -> 673.89677419354825
J48: 37042 | K48: =$I$9 -> 1440 | L48: 1847 | M48: 1161 | N48: =L48-M48 -> 686
J49: 37043 | K49: =+'\\Fs-f1\L6023\weekly\[ng storage_1995 on.xls]Inventory Estimate'!$F$66 -> 1456.8142857142857 | L49: =L$48+1*(L$10-L$9)/30 -> 1857.3333333333333 | M49: =M$48+1*(M$10-M$9)/30 -> 1173.2666666666667 | N49: =L49-M49 -> 684.06666666666661
J50: 37050 | K50: =+'\\Fs-f1\L6023\weekly\[ng storage_1995 on.xls]Inventory Estimate'!$F$67 -> 1561.8142857142857 | L50: =L$48+8*(L$10-L$9)/30 -> 1929.6666666666667 | M50: =M$48+8*(M$10-M$9)/30 -> 1259.1333333333334 | N50: =L50-M50 -> 670.5333333333333
J51: =+J50+7 -> 37057 | K51: =+'\\Fs-f1\L6023\weekly\[ng storage_1995 on.xls]Inventory Estimate'!$F$68 -> 1667.8142857142857 | L51: =L$48+15*(L$10-L$9)/30 -> 2002 | M51: =M$48+15*(M$10-M$9)/30 -> 1345 | N51: =L51-M51 -> 657
J52: =+J51+7 -> 37064 | K52: =+'\\Fs-f1\L6023\weekly\[ng storage_1995 on.xls]Inventory Estimate'!$F$69 -> 1775.8142857142857 | L52: =L$48+22*(L$10-L$9)/30 -> 2074.3333333333335 | M52: =M$48+22*(M$10-M$9)/30 -> 1430.8666666666668 | N52: =L52-M52 -> 643.4666666666667
J53: =+J52+7 -> 37071 | K53: =+'\\Fs-f1\L6023\weekly\[ng storage_1995 on.xls]Inventory Estimate'!$F$70 -> 1880.8142857142857 | L53: =L$48+29*(L$10-L$9)/30 -> 2146.6666666666665 | M53: =M$48+29*(M$10-M$9)/30 -> 1516.7333333333333 | N53: =L53-M53 -> 629.93333333333317
J54: 37072 | K54: =+'\\Fs-f1\L6023\weekly\[ng storage_1995 on.xls]Inventory Estimate'!$F$71 -> 1882 | L54: =L$48+30*(L$10-L$9)/30 -> 2157 | M54: =M$48+30*(M$10-M$9)/30 -> 1529 | N54: =L54-M54 -> 628
J55: =+J53+7 -> 37078 | K55: =+'\\Fs-f1\L6023\weekly\[ng storage_1995 on.xls]Inventory Estimate'!$F$72 -> 1976.2857142857142 | L55: =L$48+6*(L$11-L$10)/31 -> 1899.4516129032259 | M55: =M$48+1*(M$11-M$10)/31 -> 1172.9032258064517 | N55: =L55-M55 -> 726.54838709677415
J56: =+J55+7 -> 37085 | K56: =+'\\Fs-f1\L6023\weekly\[ng storage_1995 on.xls]Inventory Estimate'!$F$73 -> 2086.2857142857142 | L56: =L$48+13*(L$11-L$10)/31 -> 1960.6451612903227 | M56: =M$48+1*(M$11-M$10)/31 -> 1172.9032258064517 | N56: =L56-M56 -> 787.74193548387098
J57: =+J56+7 -> 37092 | K57: =+'\\Fs-f1\L6023\weekly\[ng storage_1995 on.xls]Inventory Estimate'!$F$74 -> 2170.2857142857142 | L57: =L$48+20*(L$11-L$10)/31 -> 2021.8387096774193 | M57: =M$48+1*(M$11-M$10)/31 -> 1172.9032258064517 | N57: =L57-M57 -> 848.93548387096757
J58: =+J57+7 -> 37099 | K58: =+'\\Fs-f1\L6023\weekly\[ng storage_1995 on.xls]Inventory Estimate'!$F$75 -> 2247.2857142857142 | L58: =L$48+27*(L$11-L$10)/31 -> 2083.0322580645161 | M58: =M$48+1*(M$11-M$10)/31 -> 1172.9032258064517 | N58: =L58-M58 -> 910.1290322580644
J59: 37103 | K59: =+'\\Fs-f1\L6023\weekly\[ng storage_1995 on.xls]Inventory Estimate'!$F$76 -> 2261 | L59: =L$48+31*(L$11-L$10)/31 -> 2118 | M59: =M$48+1*(M$11-M$10)/31 -> 1172.9032258064517 | N59: =L59-M59 -> 945.0967741935483
J60: =+J58+7 -> 37106 | K60: =+'\\Fs-f1\L6023\weekly\[ng storage_1995 on.xls]Inventory Estimate'!$F$77 -> 2295.2857142857142 | L60: =L$48+1*(L$12-L$11)/31 -> 1855.7096774193549 | M60: =M$48+1*(M$12-M$11)/31 -> 1170.4193548387098 | N60: =L60-M60 -> 685.29032258064512
J61: =+J60+7 -> 37113 | K61: =+'\\Fs-f1\L6023\weekly\[ng storage_1995 on.xls]Inventory Estimate'!$F$77 -> 2295.2857142857142 | L61: =L$48+1*(L$12-L$11)/31 -> 1855.7096774193549 | M61: =M$48+1*(M$12-M$11)/31 -> 1170.4193548387098 | N61: =L61-M61 -> 685.29032258064512
J62: =+J61+7 -> 37120
J63: =+J62+7 -> 37127