B3: Monthly Actual Data | I3: Monthly EIA 191 Survey Data
A4: Month | B4: 1995 | C4: 1996 | D4: 1997 | E4: 1998 | F4: 1999 | G4: 2000 | I4: 2001 | L4: 6-Year High (1995-2000) | M4: 6-Year Low (1995-2000) | N4: Difference
A5: January | B5: 2045 | C5: 1462.468304 | D5: 1495.563116 | E5: 1712 | F5: 2094 | G5: 1724.6516630000001 | I5: 1265 | J5: 35826 | K5: 1712 | L5: 2094 | M5: 1462 | N5: =L5-M5 -> 632
A6: February | B6: 1542 | C6: 1020.58242 | D6: 1139.4220359999999 | E6: 1426 | F6: 1792 | G6: 1300.4144570000001 | I6: 912 | J6: 35854 | K6: 1426 | L6: 1792 | M6: 1021 | N6: =L6-M6 -> 771
A7: March | B7: 1332 | C7: 757.994642 | D7: 990.43301299999996 | E7: 1183 | F7: 1430 | G7: 1149.9492420000001 | I7: 742 | J7: 35885 | K7: 1183 | L7: 1430 | M7: 758 | N7: =L7-M7 -> 672
A8: April | B8: 1379 | C8: 853.96110799999997 | D8: 1051.234753 | E8: 1386 | F8: 1514 | G8: 1184.3404459999999 | I8: 992 | J8: 35915 | K8: 1386 | L8: 1514 | M8: 854 | N8: =L8-M8 -> 660
A9: May | B9: 1668 | C9: 1161.114546 | D9: 1364.797456 | E9: 1774 | F9: 1847 | G9: 1426.4080000000001 | I9: 1440 | J9: 35946 | K9: 1774 | L9: 1847 | M9: 1161 | N9: =L9-M9 -> 686
A10: June | B10: 2014 | C10: 1529.1247699999999 | D10: 1731.1334360000001 | E10: 2114 | F10: 2157 | G10: 1706.3 | I10: 1882.4311089999999 | J10: 35976 | K10: 2114 | L10: 2157 | M10: 1529 | N10: =L10-M10 -> 628
A11: July | B11: 2301 | C11: 1897.649343 | D11: 2016.5366449999999 | E11: 2428 | F11: 2390 | G11: 1996 | I11: 2260.7627499999999 | J11: 36007 | K11: 2428 | L11: 2428 | M11: 1898 | N11: =L11-M11 -> 530
A12: August | B12: 2495 | C12: 2244.504117 | D12: 2337.911615 | E12: 2698 | F12: 2632 | G12: 2190 | I12: 2575.7977000000001 | J12: 36038 | K12: 2698 | L12: 2698 | M12: 2190 | N12: =L12-M12 -> 508
A13: September | B13: 2802 | C13: 2604.9810189999998 | D13: 2672.3088520000001 | E13: 2928 | F13: 2884 | G13: 2473 | I13: 2944.2665150000003 | J13: 36068 | K13: 2928 | L13: 2928 | M13: 2473 | N13: =L13-M13 -> 455
A14: October | B14: 2996 | C14: 2810.4756400000001 | D14: 2885.777419 | E14: 3191 | F14: 3026 | G14: 2699 | J14: 36099 | K14: 3191 | L14: 3191 | M14: 2699 | N14: =L14-M14 -> 492
A15: November | B15: 2728 | C15: 2549.1373570000001 | D15: 2698.8862260000001 | E15: 3155 | F15: 2991 | G15: 2443 | J15: 36129 | K15: 3155 | L15: 3155 | M15: 2443 | N15: =L15-M15 -> 712
A16: December | B16: 2153 | C16: 2172.5511759999999 | D16: 2174.5195359999998 | E16: 2730 | F16: 2509 | G16: 1720 | J16: 36160 | K16: 2730 | L16: 2730 | M16: 1720 | N16: =L16-M16 -> 1010
J17: 36191 | K17: 2094 | L17: 2094 | M17: 1462 | N17: =L17-M17 -> 632
J18: 36219 | K18: 1792 | L18: 1792 | M18: 1021 | N18: =L18-M18 -> 771
J19: 36250 | K19: 1430 | L19: 1430 | M19: 758 | N19: =L19-M19 -> 672
J20: 36280 | K20: 1514 | L20: 1514 | M20: 854 | N20: =L20-M20 -> 660
J21: 36311 | K21: 1847 | L21: 1847 | M21: 1161 | N21: =L21-M21 -> 686
J22: 36341 | K22: 2157 | L22: 2157 | M22: 1529 | N22: =L22-M22 -> 628
J23: 36372 | K23: 2390 | L23: 2428 | M23: 1898 | N23: =L23-M23 -> 530
J24: 36403 | K24: 2632 | L24: 2698 | M24: 2190 | N24: =L24-M24 -> 508
J25: 36433 | K25: 2884 | L25: 2928 | M25: 2473 | N25: =L25-M25 -> 455
J26: 36464 | K26: 3026 | L26: 3191 | M26: 2699 | N26: =L26-M26 -> 492
J27: 36494 | K27: 2991 | L27: 3155 | M27: 2443 | N27: =L27-M27 -> 712
J28: 36525 | K28: 2509 | L28: 2730 | M28: 1720 | N28: =L28-M28 -> 1010
J29: 36556 | K29: 1724.6516630000001 | L29: 2094 | M29: 1462 | N29: =L29-M29 -> 632
J30: 36585 | K30: 1300.4144570000001 | L30: 1792 | M30: 1021 | N30: =L30-M30 -> 771
J31: 36616 | K31: 1149.9492420000001 | L31: 1430 | M31: 758 | N31: =L31-M31 -> 672
J32: 36646 | K32: 1184.3404459999999 | L32: 1514 | M32: 854 | N32: =L32-M32 -> 660
J33: 36677 | K33: 1426.4080000000001 | L33: 1847 | M33: 1161 | N33: =L33-M33 -> 686
J34: 36707 | K34: 1706.3 | L34: 2157 | M34: 1529 | N34: =L34-M34 -> 628
J35: 36738 | K35: 1996 | L35: 2428 | M35: 1898 | N35: =L35-M35 -> 530
J36: 36769 | K36: 2190 | L36: 2698 | M36: 2190 | N36: =L36-M36 -> 508
J37: 36799 | K37: 2473 | L37: 2928 | M37: 2473 | N37: =L37-M37 -> 455
J38: 36830 | K38: 2699 | L38: 3191 | M38: 2699 | N38: =L38-M38 -> 492
J39: 36860 | K39: 2443 | L39: 3155 | M39: 2443 | N39: =L39-M39 -> 712
J40: 36891 | K40: 1720 | L40: 2730 | M40: 1720 | N40: =L40-M40 -> 1010
J41: 36922 | K41: 1265 | L41: 2094 | M41: 1462 | N41: =L41-M41 -> 632
J42: 36950 | K42: 912 | L42: 1792 | M42: 1021 | N42: =L42-M42 -> 771
J43: 36981 | K43: 742 | L43: 1430 | M43: 758 | N43: =L43-M43 -> 672
J44: 37011 | K44: 992 | L44: 1514 | M44: 854 | N44: =L44-M44 -> 660
J45: 37042 | K45: =$I$9 -> 1440 | L45: 1847 | M45: 1161 | N45: =L45-M45 -> 686
J46: 37072 | K46: 1882.4311089999999 | L46: 2157 | M46: 1529 | N46: =L46-M46 -> 628
J47: 37103 | K47: 2260.7627499999999 | L47: 2428 | M47: 1898 | N47: =L47-M47 -> 530
J48: 37134 | K48: 2575.7977000000001 | L48: 2698 | M48: 2190 | N48: =L48-M48 -> 508
J49: 37164 | K49: 2944.2665150000003 | L49: 2928 | M49: 2473 | N49: =L49-M49 -> 455
J50: 37169 | K50: 2990.6950864285718 | L50: =$L$13+5*($L$14-$L$13)/31 -> 2970.4193548387098 | M50: =$M$13+5*($M$14-$M$13)/31 -> 2509.4516129032259 | N50: =L50-M50 -> 460.9677419354839
J51: 37176 | K51: 3053.6950864285718 | L51: =$L$13+12*($L$14-$L$13)/31 -> 3029.8064516129034 | M51: =$M$13+12*($M$14-$M$13)/31 -> 2560.483870967742 | N51: =L51-M51 -> 469.32258064516145
J52: 37183 | K52: 3078.6950864285718 | L52: =$L$13+19*($L$14-$L$13)/31 -> 3089.1935483870966 | M52: =$M$13+19*($M$14-$M$13)/31 -> 2611.516129032258 | N52: =L52-M52 -> 477.67741935483855
J53: 37190 | K53: 3101.6950864285718 | L53: =$L$13+26*($L$14-$L$13)/31 -> 3148.5806451612902 | M53: =$M$13+26*($M$14-$M$13)/31 -> 2662.5483870967741 | N53: =L53-M53 -> 486.0322580645161
J54: 37195 | K54: 3108.8379435714292 | L54: =$L$13+31*($L$14-$L$13)/31 -> 3191 | M54: =$M$13+31*($M$14-$M$13)/31 -> 2699 | N54: =L54-M54 -> 492
J55: 37197 | K55: 3146.8281428571422 | L55: =$L$14+2*($L$15-$L$14)/30 -> 3188.6 | M55: =$M$14+2*($M$15-$M$14)/30 -> 2681.9333333333334 | N55: =L55-M55 -> 506.66666666666652
J56: 37204 | K56: 3163.8281428571422 | L56: =$L$14+9*($L$15-$L$14)/30 -> 3180.2 | M56: =$M$14+9*($M$15-$M$14)/30 -> 2622.2 | N56: =L56-M56 -> 558
J57: 37211 | K57: 3178.8281428571422 | L57: =$L$14+16*($L$15-$L$14)/30 -> 3171.8 | M57: =$M$14+16*($M$15-$M$14)/30 -> 2562.4666666666667 | N57: =L57-M57 -> 609.33333333333348
J58: 37218 | K58: 3190.8281428571422 | L58: =$L$14+23*($L$15-$L$14)/30 -> 3163.4 | M58: =$M$14+23*($M$15-$M$14)/30 -> 2502.7333333333331 | N58: =L58-M58 -> 660.66666666666697
J59: 37225 | K59: 3174.8281428571422 | L59: =$L$14+30*($L$15-$L$14)/30 -> 3155 | M59: =$M$14+30*($M$15-$M$14)/30 -> 2443 | N59: =L59-M59 -> 712
J60: 37232 | K60: 3152.8281428571422 | L60: =$L$15+7*($L$16-$L$15)/31 -> 3059.0322580645161 | M60: =$M$15+7*($M$16-$M$15)/31 -> 2279.7419354838712 | N60: =L60-M60 -> 779.2903225806449
J61: 37239 | K61: 3107.8281428571422 | L61: =$L$15+14*($L$16-$L$15)/31 -> 2963.0645161290322 | M61: =$M$15+14*($M$16-$M$15)/31 -> 2116.483870967742 | N61: =L61-M61 -> 846.58064516129025
J62: 37246 | K62: 3026.8281428571422 | L62: =$L$15+21*($L$16-$L$15)/31 -> 2867.0967741935483 | M62: =$M$15+21*($M$16-$M$15)/31 -> 1953.2258064516129 | N62: =L62-M62 -> 913.87096774193537
J63: 37253 | K63: 2903 | L63: =$L$15+28*($L$16-$L$15)/31 -> 2771.1290322580644 | M63: =$M$15+28*($M$16-$M$15)/31 -> 1789.9677419354839 | N63: =L63-M63 -> 981.1612903225805
J64: 37260
J65: 37267
J66: 37274
J67: 37281
J68: 37288
J69: 37295
J70: 37302
J71: 37309
J72: 37316
J73: 37323
J74: 37330
J75: 37337
J76: 37344
J77: 37351
J78: 37358
J79: 37365
J80: 37372
J81: 37379
J82: 37386
J83: 37393
J84: 37400
J85: 37407
J86: 37414
J87: 37421
J88: 37428
J89: 37435
J90: 37442
J91: 37449
J92: 37456
J93: 37463
J94: 37470
J95: 37477
J96: 37484
J97: 37491
J98: 37498
J99: 37505
J100: 37512
J101: 37519
J102: 37526
J103: 37533
J104: 37540
J105: 37547
J106: 37554
J107: 37561
J108: 37568
J109: 37575
J110: 37582
J111: 37589
J112: 37596
J113: 37603
J114: 37610
J115: 37617
J116: 37624
J117: 37631
J118: 37638
J119: 37645
J120: 37652