B3: Monthly Actual Data | I3: Monthly EIA 191 Survey Data
A4: Month | B4: 1995 | C4: 1996 | D4: 1997 | E4: 1998 | F4: 1999 | G4: 2000 | I4: 2001 | L4: 6-Year High (1995-2000) | M4: 6-Year Low (1995-2000) | N4: Difference
A5: January | B5: 2045 | C5: 1462.468304 | D5: 1495.563116 | E5: 1712 | F5: 2094 | G5: 1724.6516630000001 | I5: 1265 | J5: 35826 | K5: 1712 | L5: 2094 | M5: 1462 | N5: =L5-M5 -> 632
A6: February | B6: 1542 | C6: 1020.58242 | D6: 1139.4220359999999 | E6: 1426 | F6: 1792 | G6: 1300.4144570000001 | I6: 912 | J6: 35854 | K6: 1426 | L6: 1792 | M6: 1021 | N6: =L6-M6 -> 771
A7: March | B7: 1332 | C7: 757.994642 | D7: 990.43301299999996 | E7: 1183 | F7: 1430 | G7: 1149.9492420000001 | I7: 742 | J7: 35885 | K7: 1183 | L7: 1430 | M7: 758 | N7: =L7-M7 -> 672
A8: April | B8: 1379 | C8: 853.96110799999997 | D8: 1051.234753 | E8: 1386 | F8: 1514 | G8: 1184.3404459999999 | I8: 992 | J8: 35915 | K8: 1386 | L8: 1514 | M8: 854 | N8: =L8-M8 -> 660
A9: May | B9: 1668 | C9: 1161.114546 | D9: 1364.797456 | E9: 1774 | F9: 1847 | G9: 1426.4080000000001 | I9: 1440 | J9: 35946 | K9: 1774 | L9: 1847 | M9: 1161 | N9: =L9-M9 -> 686
A10: June | B10: 2014 | C10: 1529.1247699999999 | D10: 1731.1334360000001 | E10: 2114 | F10: 2157 | G10: 1706.3 | I10: 1874 | J10: 35976 | K10: 2114 | L10: 2157 | M10: 1529 | N10: =L10-M10 -> 628
A11: July | B11: 2301 | C11: 1897.649343 | D11: 2016.5366449999999 | E11: 2428 | F11: 2390 | G11: 1996 | J11: 36007 | K11: 2428 | L11: 2428 | M11: 1898 | N11: =L11-M11 -> 530
A12: August | B12: 2495 | C12: 2244.504117 | D12: 2337.911615 | E12: 2698 | F12: 2632 | G12: 2190 | J12: 36038 | K12: 2698 | L12: 2698 | M12: 2190 | N12: =L12-M12 -> 508
A13: September | B13: 2802 | C13: 2604.9810189999998 | D13: 2672.3088520000001 | E13: 2928 | F13: 2884 | G13: 2473 | J13: 36068 | K13: 2928 | L13: 2928 | M13: 2473 | N13: =L13-M13 -> 455
A14: October | B14: 2996 | C14: 2810.4756400000001 | D14: 2885.777419 | E14: 3191 | F14: 3026 | G14: 2699 | J14: 36099 | K14: 3191 | L14: 3191 | M14: 2699 | N14: =L14-M14 -> 492
A15: November | B15: 2728 | C15: 2549.1373570000001 | D15: 2698.8862260000001 | E15: 3155 | F15: 2991 | G15: 2443 | J15: 36129 | K15: 3155 | L15: 3155 | M15: 2443 | N15: =L15-M15 -> 712
A16: December | B16: 2153 | C16: 2172.5511759999999 | D16: 2174.5195359999998 | E16: 2730 | F16: 2509 | G16: 1720 | J16: 36160 | K16: 2730 | L16: 2730 | M16: 1720 | N16: =L16-M16 -> 1010
J17: 36191 | K17: 2094 | L17: 2094 | M17: 1462 | N17: =L17-M17 -> 632
J18: 36219 | K18: 1792 | L18: 1792 | M18: 1021 | N18: =L18-M18 -> 771
J19: 36250 | K19: 1430 | L19: 1430 | M19: 758 | N19: =L19-M19 -> 672
J20: 36280 | K20: 1514 | L20: 1514 | M20: 854 | N20: =L20-M20 -> 660
J21: 36311 | K21: 1847 | L21: 1847 | M21: 1161 | N21: =L21-M21 -> 686
J22: 36341 | K22: 2157 | L22: 2157 | M22: 1529 | N22: =L22-M22 -> 628
J23: 36372 | K23: 2390 | L23: 2428 | M23: 1898 | N23: =L23-M23 -> 530
J24: 36403 | K24: 2632 | L24: 2698 | M24: 2190 | N24: =L24-M24 -> 508
J25: 36433 | K25: 2884 | L25: 2928 | M25: 2473 | N25: =L25-M25 -> 455
J26: 36464 | K26: 3026 | L26: 3191 | M26: 2699 | N26: =L26-M26 -> 492
J27: 36494 | K27: 2991 | L27: 3155 | M27: 2443 | N27: =L27-M27 -> 712
J28: 36525 | K28: 2509 | L28: 2730 | M28: 1720 | N28: =L28-M28 -> 1010
J29: 36556 | K29: 1724.6516630000001 | L29: 2094 | M29: 1462 | N29: =L29-M29 -> 632
J30: 36585 | K30: 1300.4144570000001 | L30: 1792 | M30: 1021 | N30: =L30-M30 -> 771
J31: 36616 | K31: 1149.9492420000001 | L31: 1430 | M31: 758 | N31: =L31-M31 -> 672
J32: 36646 | K32: 1184.3404459999999 | L32: 1514 | M32: 854 | N32: =L32-M32 -> 660
J33: 36677 | K33: 1426.4080000000001 | L33: 1847 | M33: 1161 | N33: =L33-M33 -> 686
J34: 36707 | K34: 1706.3 | L34: 2157 | M34: 1529 | N34: =L34-M34 -> 628
J35: 36738 | K35: 1996 | L35: 2428 | M35: 1898 | N35: =L35-M35 -> 530
J36: 36769 | K36: 2190 | L36: 2698 | M36: 2190 | N36: =L36-M36 -> 508
J37: 36799 | K37: 2473 | L37: 2928 | M37: 2473 | N37: =L37-M37 -> 455
J38: 36830 | K38: 2699 | L38: 3191 | M38: 2699 | N38: =L38-M38 -> 492
J39: 36860 | K39: 2443 | L39: 3155 | M39: 2443 | N39: =L39-M39 -> 712
J40: 36891 | K40: 1720 | L40: 2730 | M40: 1720 | N40: =L40-M40 -> 1010
J41: 36922 | K41: 1265 | L41: 2094 | M41: 1462 | N41: =L41-M41 -> 632
J42: 36950 | K42: 912 | L42: 1792 | M42: 1021 | N42: =L42-M42 -> 771
J43: 36981 | K43: 742 | L43: 1430 | M43: 758 | N43: =L43-M43 -> 672
J44: 37011 | K44: 992 | L44: 1514 | M44: 854 | N44: =L44-M44 -> 660
J45: 37042 | K45: =$I$9 -> 1440 | L45: 1847 | M45: 1161 | N45: =L45-M45 -> 686
J46: 37072 | K46: 1874 | L46: 2157 | M46: 1529 | N46: =L46-M46 -> 628
J47: 37078 | K47: =+'\\Fs-f1\L6023\weekly\[ng storage_1995 on.xls]Inventory Estimate'!$F$72 -> 1976.2857142857142 | L47: =L$10+6*(L$11-L$10)/31 -> 2209.4516129032259 | M47: =M$10+6*(M$11-M$10)/31 -> 1600.4193548387098 | N47: =L47-M47 -> 609.0322580645161
J48: =+J47+7 -> 37085 | K48: =+'\\Fs-f1\L6023\weekly\[ng storage_1995 on.xls]Inventory Estimate'!$F$73 -> 2086.2857142857142 | L48: =L$10+13*(L$11-L$10)/31 -> 2270.6451612903224 | M48: =M$10+13*(M$11-M$10)/31 -> 1683.741935483871 | N48: =L48-M48 -> 586.90322580645147
J49: =+J48+7 -> 37092 | K49: =+'\\Fs-f1\L6023\weekly\[ng storage_1995 on.xls]Inventory Estimate'!$F$74 -> 2170.2857142857142 | L49: =L$10+20*(L$11-L$10)/31 -> 2331.8387096774195 | M49: =M$10+20*(M$11-M$10)/31 -> 1767.0645161290322 | N49: =L49-M49 -> 564.7741935483873
J50: =+J49+7 -> 37099 | K50: =+'\\Fs-f1\L6023\weekly\[ng storage_1995 on.xls]Inventory Estimate'!$F$75 -> 2247.2857142857142 | L50: =L$10+27*(L$11-L$10)/31 -> 2393.0322580645161 | M50: =M$10+27*(M$11-M$10)/31 -> 1850.3870967741937 | N50: =L50-M50 -> 542.64516129032245
J51: 37103 | K51: =+'\\Fs-f1\L6023\weekly\[ng storage_1995 on.xls]Inventory Estimate'!$F$76 -> 2261 | L51: =L$10+31*(L$11-L$10)/31 -> 2428 | M51: =M$10+31*(M$11-M$10)/31 -> 1898 | N51: =L51-M51 -> 530
J52: =+J50+7 -> 37106 | K52: =+'\\Fs-f1\L6023\weekly\[ng storage_1995 on.xls]Inventory Estimate'!$F$77 -> 2295.2857142857142 | L52: =L$11+3*(L$12-L$11)/31 -> 2454.1290322580644 | M52: =M$11+6*(M$12-M$11)/31 -> 1954.516129032258 | N52: =L52-M52 -> 499.61290322580635
J53: =+J52+7 -> 37113 | K53: =+'\\Fs-f1\L6023\weekly\[ng storage_1995 on.xls]Inventory Estimate'!$F78 -> 2345.2857142857142 | L53: =L$11+10*(L$12-L$11)/31 -> 2515.0967741935483 | M53: =M$11+10*(M$12-M$11)/31 -> 1992.1935483870968 | N53: =L53-M53 -> 522.90322580645147
J54: =+J53+7 -> 37120 | K54: =+'\\Fs-f1\L6023\weekly\[ng storage_1995 on.xls]Inventory Estimate'!$F79 -> 2431.2857142857142 | L54: =L$11+17*(L$12-L$11)/31 -> 2576.0645161290322 | M54: =M$11+17*(M$12-M$11)/31 -> 2058.1290322580644 | N54: =L54-M54 -> 517.9354838709678
J55: =+J54+7 -> 37127 | K55: =+'\\Fs-f1\L6023\weekly\[ng storage_1995 on.xls]Inventory Estimate'!$F80 -> 2507.2857142857142 | L55: =L$11+24*(L$12-L$11)/31 -> 2637.0322580645161 | M55: =M$11+24*(M$12-M$11)/31 -> 2124.0645161290322 | N55: =L55-M55 -> 512.9677419354839
J56: =+J55+7 -> 37134 | K56: =+'\\Fs-f1\L6023\weekly\[ng storage_1995 on.xls]Inventory Estimate'!$F81 -> 2575.7 | L56: =L$11+31*(L$12-L$11)/31 -> 2698 | M56: =M$11+31*(M$12-M$11)/31 -> 2190 | N56: =L56-M56 -> 508
J57: =+J56+7 -> 37141 | K57: =+'\\Fs-f1\L6023\weekly\[ng storage_1995 on.xls]Inventory Estimate'!$F82 -> 2670.7 | L57: =L$12+7*(L13-L$12)/30 -> 2751.6666666666665 | M57: =M$12+7*(M$13-M$12)/30 -> 2256.0333333333333 | N57: =L57-M57 -> 495.63333333333321
J58: =+J57+7 -> 37148 | K58: =+'\\Fs-f1\L6023\weekly\[ng storage_1995 on.xls]Inventory Estimate'!$F83 -> 2760.7 | L58: =L$12+14*(L$13-L$12)/30 -> 2805.3333333333335 | M58: =M$12+14*(M$13-M$12)/30 -> 2322.0666666666666 | N58: =L58-M58 -> 483.26666666666688
J59: =+J58+7 -> 37155 | K59: =+'\\Fs-f1\L6023\weekly\[ng storage_1995 on.xls]Inventory Estimate'!$F84 -> 2851.7 | L59: =L$12+21*(L$13-L$12)/30 -> 2859 | M59: =M$12+21*(M$13-M$12)/30 -> 2388.1 | N59: =L59-M59 -> 470.9
J60: =+J59+7 -> 37162 | K60: =+'\\Fs-f1\L6023\weekly\[ng storage_1995 on.xls]Inventory Estimate'!$F85 -> 2917.7 | L60: =L$12+28*(L$13-L$12)/30 -> 2912.6666666666665 | M60: =M$12+28*(M$13-M$12)/30 -> 2454.1333333333332 | N60: =L60-M60 -> 458.5333333333333
J61: =+J60+7 -> 37169 | K61: =+'\\Fs-f1\L6023\weekly\[ng storage_1995 on.xls]Inventory Estimate'!$F86 -> 2936.2714285714283 | L61: =L$13+5*(L$14-L$13)/31 -> 2970.4193548387098 | M61: =M$13+5*(M$14-M$13)/31 -> 2509.4516129032259 | N61: =L61-M61 -> 460.9677419354839
J62: =+J61+7 -> 37176 | K62: =+'\\Fs-f1\L6023\weekly\[ng storage_1995 on.xls]Inventory Estimate'!$F87 -> 2982.7 | L62: =L$13+12*(L$14-L$13)/31 -> 3029.8064516129034 | M62: =M$13+12*(M$14-M$13)/31 -> 2560.483870967742 | N62: =L62-M62 -> 469.32258064516145
J63: =+J62+7 -> 37183 | K63: =+'\\Fs-f1\L6023\weekly\[ng storage_1995 on.xls]Inventory Estimate'!$F88 -> 3045.7 | L63: =L$13+19*(L$14-L$13)/31 -> 3089.1935483870966 | M63: =M$13+19*(M$14-M$13)/31 -> 2611.516129032258 | N63: =L63-M63 -> 477.67741935483855
J64: =+J63+7 -> 37190 | K64: =+'\\Fs-f1\L6023\weekly\[ng storage_1995 on.xls]Inventory Estimate'!$F89 -> 3070.7 | L64: =L$13+26*(L$14-L$13)/31 -> 3148.5806451612902 | M64: =M$13+26*(M$14-M$13)/31 -> 2662.5483870967741 | N64: =L64-M64 -> 486.0322580645161
J65: =+J64+7 -> 37197 | K65: =+'\\Fs-f1\L6023\weekly\[ng storage_1995 on.xls]Inventory Estimate'!$F90 -> 3093.7 | L65: =L$14+2*(L$15-L$14)/30 -> 3188.6 | M65: =M$14+2*(M$15-M$14)/30 -> 2681.9333333333334 | N65: =L65-M65 -> 506.66666666666652