B3: Monthly Actual Data | I3: Monthly EIA 191 Survey Data
A4: Month | B4: 1995 | C4: 1996 | D4: 1997 | E4: 1998 | F4: 1999 | G4: 2000 | I4: 2001 | M4: 6-Year High (1995-2000) | N4: 6-Year Low (1995-2000) | O4: Difference
A5: January | B5: 2045 | C5: 1462.468304 | D5: 1495.563116 | E5: 1712 | F5: 2094 | G5: 1724.6516630000001 | I5: 1265 | J5: 35796 | K5: 35826 | L5: 1712 | M5: 2094 | N5: 1462 | O5: =M5-N5 -> 632
A6: February | B6: 1542 | C6: 1020.58242 | D6: 1139.4220359999999 | E6: 1426 | F6: 1792 | G6: 1300.4144570000001 | I6: 912 | J6: 35827 | K6: 35854 | L6: 1426 | M6: 1792 | N6: 1021 | O6: =M6-N6 -> 771
A7: March | B7: 1332 | C7: 757.994642 | D7: 990.43301299999996 | E7: 1183 | F7: 1430 | G7: 1149.9492420000001 | I7: 742 | J7: 35855 | K7: 35885 | L7: 1183 | M7: 1430 | N7: 758 | O7: =M7-N7 -> 672
A8: April | B8: 1379 | C8: 853.96110799999997 | D8: 1051.234753 | E8: 1386 | F8: 1514 | G8: 1184.3404459999999 | I8: 992 | J8: 35886 | K8: 35915 | L8: 1386 | M8: 1514 | N8: 854 | O8: =M8-N8 -> 660
A9: May | B9: 1668 | C9: 1161.114546 | D9: 1364.797456 | E9: 1774 | F9: 1847 | G9: 1426.4080000000001 | J9: 35916 | K9: 35946 | L9: 1774 | M9: 1847 | N9: 1161 | O9: =M9-N9 -> 686
A10: June | B10: 2014 | C10: 1529.1247699999999 | D10: 1731.1334360000001 | E10: 2114 | F10: 2157 | G10: 1706.3 | J10: 35947 | K10: 35976 | L10: 2114 | M10: 2157 | N10: 1529 | O10: =M10-N10 -> 628
A11: July | B11: 2301 | C11: 1897.649343 | D11: 2016.5366449999999 | E11: 2428 | F11: 2390 | G11: 1996 | J11: 35977 | K11: 36007 | L11: 2428 | M11: 2428 | N11: 1898 | O11: =M11-N11 -> 530
A12: August | B12: 2495 | C12: 2244.504117 | D12: 2337.911615 | E12: 2698 | F12: 2632 | G12: 2190 | J12: 36008 | K12: 36038 | L12: 2698 | M12: 2698 | N12: 2190 | O12: =M12-N12 -> 508
A13: September | B13: 2802 | C13: 2604.9810189999998 | D13: 2672.3088520000001 | E13: 2928 | F13: 2884 | G13: 2473 | J13: 36039 | K13: 36068 | L13: 2928 | M13: 2928 | N13: 2473 | O13: =M13-N13 -> 455
A14: October | B14: 2996 | C14: 2810.4756400000001 | D14: 2885.777419 | E14: 3191 | F14: 3026 | G14: 2699 | J14: 36069 | K14: 36099 | L14: 3191 | M14: 3191 | N14: 2699 | O14: =M14-N14 -> 492
A15: November | B15: 2728 | C15: 2549.1373570000001 | D15: 2698.8862260000001 | E15: 3155 | F15: 2991 | G15: 2443 | J15: 36100 | K15: 36129 | L15: 3155 | M15: 3155 | N15: 2443 | O15: =M15-N15 -> 712
A16: December | B16: 2153 | C16: 2172.5511759999999 | D16: 2174.5195359999998 | E16: 2730 | F16: 2509 | G16: 1720 | J16: 36130 | K16: 36160 | L16: 2730 | M16: 2730 | N16: 1720 | O16: =M16-N16 -> 1010
J17: 36161 | K17: 36191 | L17: 2094 | M17: 2094 | N17: 1462 | O17: =M17-N17 -> 632
J18: 36192 | K18: 36219 | L18: 1792 | M18: 1792 | N18: 1021 | O18: =M18-N18 -> 771
J19: 36220 | K19: 36250 | L19: 1430 | M19: 1430 | N19: 758 | O19: =M19-N19 -> 672
J20: 36251 | K20: 36280 | L20: 1514 | M20: 1514 | N20: 854 | O20: =M20-N20 -> 660
J21: 36281 | K21: 36311 | L21: 1847 | M21: 1847 | N21: 1161 | O21: =M21-N21 -> 686
J22: 36312 | K22: 36341 | L22: 2157 | M22: 2157 | N22: 1529 | O22: =M22-N22 -> 628
J23: 36342 | K23: 36372 | L23: 2390 | M23: 2428 | N23: 1898 | O23: =M23-N23 -> 530
J24: 36373 | K24: 36403 | L24: 2632 | M24: 2698 | N24: 2190 | O24: =M24-N24 -> 508
J25: 36404 | K25: 36433 | L25: 2884 | M25: 2928 | N25: 2473 | O25: =M25-N25 -> 455
J26: 36434 | K26: 36464 | L26: 3026 | M26: 3191 | N26: 2699 | O26: =M26-N26 -> 492
J27: 36465 | K27: 36494 | L27: 2991 | M27: 3155 | N27: 2443 | O27: =M27-N27 -> 712
J28: 36495 | K28: 36525 | L28: 2509 | M28: 2730 | N28: 1720 | O28: =M28-N28 -> 1010
J29: 36526 | K29: 36556 | L29: 1724.6516630000001 | M29: 2094 | N29: 1462 | O29: =M29-N29 -> 632
J30: 36557 | K30: 36585 | L30: 1300.4144570000001 | M30: 1792 | N30: 1021 | O30: =M30-N30 -> 771
J31: 36586 | K31: 36616 | L31: 1149.9492420000001 | M31: 1430 | N31: 758 | O31: =M31-N31 -> 672
J32: 36617 | K32: 36646 | L32: 1184.3404459999999 | M32: 1514 | N32: 854 | O32: =M32-N32 -> 660
J33: 36647 | K33: 36677 | L33: 1426.4080000000001 | M33: 1847 | N33: 1161 | O33: =M33-N33 -> 686
J34: 36678 | K34: 36707 | L34: 1706.3 | M34: 2157 | N34: 1529 | O34: =M34-N34 -> 628
J35: 36708 | K35: 36738 | L35: 1996 | M35: 2428 | N35: 1898 | O35: =M35-N35 -> 530
J36: 36739 | K36: 36769 | L36: 2190 | M36: 2698 | N36: 2190 | O36: =M36-N36 -> 508
J37: 36770 | K37: 36799 | L37: 2473 | M37: 2928 | N37: 2473 | O37: =M37-N37 -> 455
J38: 36800 | K38: 36830 | L38: 2699 | M38: 3191 | N38: 2699 | O38: =M38-N38 -> 492
J39: 36831 | K39: 36860 | L39: 2443 | M39: 3155 | N39: 2443 | O39: =M39-N39 -> 712
J40: 36861 | K40: 36891 | L40: 1720 | M40: 2730 | N40: 1720 | O40: =M40-N40 -> 1010
J41: 36892 | K41: 36922 | L41: 1265 | M41: 2094 | N41: 1462 | O41: =M41-N41 -> 632
J42: 36923 | K42: 36950 | L42: 912 | M42: 1792 | N42: 1021 | O42: =M42-N42 -> 771
J43: 36951 | K43: 36981 | L43: 742 | M43: 1430 | N43: 758 | O43: =M43-N43 -> 672
J44: 36982 | K44: 37011 | L44: 992 | M44: 1514 | N44: 854 | O44: =M44-N44 -> 660
J45: 37015 | K45: 37015 | L45: 1063 | M45: =3*(M$32-M$31)/30+4*(M$33-M$32)/31+M44 -> 1565.3677419354838 | N45: =3*(N$32-N$31)/30+4*(N$33-N$32)/31+N44 -> 903.21290322580649 | O45: =M45-N45 -> 662.15483870967728
J46: 37022 | K46: 37022 | L46: 1169 | M46: =7*(M$33-M$32)/31+M45 -> 1640.5612903225806 | N46: =7*(N$33-N$32)/31+N45 -> 972.53548387096782 | O46: =M46-N46 -> 668.02580645161277
J47: 37029 | K47: 37029 | L47: 1287 | M47: =7*(M$33-M$32)/31+M46 -> 1715.7548387096774 | N47: =7*(N$33-N$32)/31+N46 -> 1041.8580645161292 | O47: =M47-N47 -> 673.89677419354825
J48: 37036 | K48: 37036 | L48: 1394 | M48: =7*(M$33-M$32)/31+M47 -> 1790.9483870967742 | N48: =7*(N$33-N$32)/31+N47 -> 1111.1806451612904 | O48: =M48-N48 -> 679.76774193548385
J49: 37043 | K49: 37043 | L49: 1511 | M49: =6*(M$33-M$32)/31+1*(M$34-M$33)/30+M48 -> 1865.7333333333333 | N49: =6*(N$33-N$32)/31+1*(N$34-N$33)/30+N48 -> 1182.8666666666668 | O49: =M49-N49 -> 682.86666666666656
J50: 37050 | K50: 37050 | L50: 1616 | M50: =7*(M$34-M$33)/30+M49 -> 1938.0666666666666 | N50: =7*(N$34-N$33)/30+N49 -> 1268.7333333333333 | O50: =M50-N50 -> 669.33333333333326
J51: =+J50+7 -> 37057 | K51: =+K50+7 -> 37057 | L51: 1722 | M51: =7*(M$34-M$33)/30+M50 -> 2010.4 | N51: =7*(N$34-N$33)/30+N50 -> 1354.6 | O51: =M51-N51 -> 655.8
J52: =+J51+7 -> 37064 | K52: =+K51+7 -> 37064 | L52: 1813 | M52: =7*(M$34-M$33)/30+M51 -> 2082.7333333333331 | N52: =7*(N$34-N$33)/30+N51 -> 1440.4666666666665 | O52: =M52-N52 -> 642.26666666666665
J53: =+J52+7 -> 37071 | K53: =+K52+7 -> 37071 | L53: 1918 | M53: =7*(M$34-M$33)/30+M52 -> 2155.0666666666666 | N53: =7*(N$34-N$33)/30+N52 -> 1526.333333333333 | O53: =M53-N53 -> 628.73333333333358
J54: =+J53+7 -> 37078