H3: Monthly Actual Data | O3: Monthly Estimates | Q3: Weekly Estimates
A4: 0 | B4: 6-Year High (1995-99) | C4: 6-Year Low (1995-99) | G4: Month | H4: 1995 | I4: 1996 | J4: 1997 | K4: 1998 | L4: 1999 | M4: 2000 | O4: 2001 | U4: 6-Year High (1995-2000) | V4: 6-Year Low (1995-2000) | W4: Difference
A5: Jan | B5: 2094 | C5: 1462 | G5: January | H5: 2045 | I5: 1462.468304 | J5: 1495.563116 | K5: 1712 | L5: 2094 | M5: 1724.6516630000001 | O5: 1265 | P5: 36896 | Q5: 1600.7142857142858 | R5: 35796 | S5: 35826 | T5: 1712 | U5: 2094 | V5: 1462 | W5: =U5-V5 -> 632
A6: Feb | B6: 1792 | C6: 1021 | G6: February | H6: 1542 | I6: 1020.58242 | J6: 1139.4220359999999 | K6: 1426 | L6: 1792 | M6: 1300.4144570000001 | O6: 912 | P6: 36903 | Q6: 1497.7142857142858 | R6: 35827 | S6: 35854 | T6: 1426 | U6: 1792 | V6: 1021 | W6: =U6-V6 -> 771
A7: Mar | B7: 1430 | C7: 758 | G7: March | H7: 1332 | I7: 757.994642 | J7: 990.43301299999996 | K7: 1183 | L7: 1430 | M7: 1149.9492420000001 | P7: 36910 | Q7: 1407.7142857142858 | R7: 35855 | S7: 35885 | T7: 1183 | U7: 1430 | V7: 758 | W7: =U7-V7 -> 672
A8: Apr | B8: 1514 | C8: 854 | G8: April | H8: 1379 | I8: 853.96110799999997 | J8: 1051.234753 | K8: 1386 | L8: 1514 | M8: 1184.3404459999999 | P8: 36917 | Q8: 1279.7142857142858 | R8: 35886 | S8: 35915 | T8: 1386 | U8: 1514 | V8: 854 | W8: =U8-V8 -> 660
A9: May | B9: 1847 | C9: 1161 | G9: May | H9: 1668 | I9: 1161.114546 | J9: 1364.797456 | K9: 1774 | L9: 1847 | M9: 1426.4080000000001 | P9: 36922 | Q9: 1265 | R9: 35916 | S9: 35946 | T9: 1774 | U9: 1847 | V9: 1161 | W9: =U9-V9 -> 686
A10: Jun | B10: 2157 | C10: 1529 | G10: June | H10: 2014 | I10: 1529.1247699999999 | J10: 1731.1334360000001 | K10: 2114 | L10: 2157 | M10: 1706.3 | P10: 36924 | Q10: 1235 | R10: 35947 | S10: 35976 | T10: 2114 | U10: 2157 | V10: 1529 | W10: =U10-V10 -> 628
A11: Jul | B11: 2428 | C11: 1898 | G11: July | H11: 2301 | I11: 1897.649343 | J11: 2016.5366449999999 | K11: 2428 | L11: 2390 | M11: 1996 | P11: 36931 | Q11: 1140 | R11: 35977 | S11: 36007 | T11: 2428 | U11: 2428 | V11: 1898 | W11: =U11-V11 -> 530
A12: Aug | B12: 2698 | C12: 2190 | G12: August | H12: 2495 | I12: 2244.504117 | J12: 2337.911615 | K12: 2698 | L12: 2632 | M12: 2190 | P12: 36938 | Q12: 1059 | R12: 36008 | S12: 36038 | T12: 2698 | U12: 2698 | V12: 2190 | W12: =U12-V12 -> 508
A13: Sep | B13: 2928 | C13: 2473 | G13: September | H13: 2802 | I13: 2604.9810189999998 | J13: 2672.3088520000001 | K13: 2928 | L13: 2884 | M13: 2473 | P13: 36945 | Q13: 958 | R13: 36039 | S13: 36068 | T13: 2928 | U13: 2928 | V13: 2473 | W13: =U13-V13 -> 455
A14: Oct | B14: 3191 | C14: 2699 | G14: October | H14: 2996 | I14: 2810.4756400000001 | J14: 2885.777419 | K14: 3191 | L14: 3026 | M14: 2699 | P14: 36950 | Q14: 912 | R14: 36069 | S14: 36099 | T14: 3191 | U14: 3191 | V14: 2699 | W14: =U14-V14 -> 492
A15: Nov | B15: 3155 | C15: 2443 | G15: November | H15: 2728 | I15: 2549.1373570000001 | J15: 2698.8862260000001 | K15: 3155 | L15: 2991 | M15: 2443 | P15: 36952 | Q15: 891.14285714285711 | R15: 36100 | S15: 36129 | T15: 3155 | U15: 3155 | V15: 2443 | W15: =U15-V15 -> 712
A16: Dec | B16: 2730 | C16: 1720 | G16: December | H16: 2153 | I16: 2172.5511759999999 | J16: 2174.5195359999998 | K16: 2730 | L16: 2509 | M16: 1720 | P16: 36959 | Q16: 816.14285714285711 | R16: 36130 | S16: 36160 | T16: 2730 | U16: 2730 | V16: 1720 | W16: =U16-V16 -> 1010
P17: 36966 | Q17: 793.14285714285711 | R17: 36161 | S17: 36191 | T17: 2094 | U17: 2094 | V17: 1462 | W17: =U17-V17 -> 632
H18: 6-Year High (1995-2000) | I18: 6-Year Low (1995-2000) | P18: 36973 | Q18: 781.14285714285711 | R18: 36192 | S18: 36219 | T18: 1792 | U18: 1792 | V18: 1021 | W18: =U18-V18 -> 771
G19: Jan | H19: 2094 | I19: 1462 | P19: 36980 | Q19: 732.14285714285711 | R19: 36220 | S19: 36250 | T19: 1430 | U19: 1430 | V19: 758 | W19: =U19-V19 -> 672
G20: Feb | H20: 1792 | I20: 1021 | P20: 36981 | Q20: 734.14285714285711 | R20: 36251 | S20: 36280 | T20: 1514 | U20: 1514 | V20: 854 | W20: =U20-V20 -> 660
G21: Mar | H21: 1430 | I21: 758 | P21: 36987 | Q21: 746.14285714285711 | R21: 36281 | S21: 36311 | T21: 1847 | U21: 1847 | V21: 1161 | W21: =U21-V21 -> 686
G22: Apr | H22: 1514 | I22: 854 | P22: 36994 | Q22: 810.14285714285711 | R22: 36312 | S22: 36341 | T22: 2157 | U22: 2157 | V22: 1529 | W22: =U22-V22 -> 628
G23: May | H23: 1847 | I23: 1161 | P23: 37001 | Q23: 853.14285714285711 | R23: 36342 | S23: 36372 | T23: 2390 | U23: 2428 | V23: 1898 | W23: =U23-V23 -> 530
G24: Jun | H24: 2157 | I24: 1529 | P24: 37008 | Q24: 955.14285714285711 | R24: 36373 | S24: 36403 | T24: 2632 | U24: 2698 | V24: 2190 | W24: =U24-V24 -> 508
G25: Jul | H25: 2428 | I25: 1898 | P25: 37011 | R25: 36404 | S25: 36433 | T25: 2884 | U25: 2928 | V25: 2473 | W25: =U25-V25 -> 455
G26: Aug | H26: 2698 | I26: 2190 | P26: 37015 | R26: 36434 | S26: 36464 | T26: 3026 | U26: 3191 | V26: 2699 | W26: =U26-V26 -> 492
G27: Sep | H27: 2928 | I27: 2473 | P27: 37022 | R27: 36465 | S27: 36494 | T27: 2991 | U27: 3155 | V27: 2443 | W27: =U27-V27 -> 712
G28: Oct | H28: 3191 | I28: 2699 | P28: 37029 | R28: 36495 | S28: 36525 | T28: 2509 | U28: 2730 | V28: 1720 | W28: =U28-V28 -> 1010
G29: Nov | H29: 3155 | I29: 2443 | P29: 37036 | R29: 36526 | S29: 36556 | T29: 1724.6516630000001 | U29: 2094 | V29: 1462 | W29: =U29-V29 -> 632
G30: Dec | H30: 2730 | I30: 1720 | P30: 37042 | R30: 36557 | S30: 36585 | T30: 1300.4144570000001 | U30: 1792 | V30: 1021 | W30: =U30-V30 -> 771
P31: 37043 | R31: 36586 | S31: 36616 | T31: 1149.9492420000001 | U31: 1430 | V31: 758 | W31: =U31-V31 -> 672
P32: 37050 | R32: 36617 | S32: 36646 | T32: 1184.3404459999999 | U32: 1514 | V32: 854 | W32: =U32-V32 -> 660
P33: 37057 | R33: 36647 | S33: 36677 | T33: 1426.4080000000001 | U33: 1847 | V33: 1161 | W33: =U33-V33 -> 686
P34: 37064 | R34: 36678 | S34: 36707 | T34: 1706.3 | U34: 2157 | V34: 1529 | W34: =U34-V34 -> 628
P35: 37071 | R35: 36708 | S35: 36738 | T35: 1996 | U35: 2428 | V35: 1898 | W35: =U35-V35 -> 530
P36: 37072 | R36: 36739 | S36: 36769 | T36: 2190 | U36: 2698 | V36: 2190 | W36: =U36-V36 -> 508
P37: 37078 | R37: 36770 | S37: 36799 | T37: 2473 | U37: 2928 | V37: 2473 | W37: =U37-V37 -> 455
P38: 37085 | R38: 36800 | S38: 36830 | T38: 2699 | U38: 3191 | V38: 2699 | W38: =U38-V38 -> 492
P39: 37092 | R39: 36831 | S39: 36860 | T39: 2443 | U39: 3155 | V39: 2443 | W39: =U39-V39 -> 712
P40: 37099 | R40: 36861 | S40: 36891 | T40: 1720 | U40: 2730 | V40: 1720 | W40: =U40-V40 -> 1010
P41: 37103 | R41: 36892 | S41: 36922 | T41: 1265 | U41: 2094 | V41: 1462 | W41: =U41-V41 -> 632
P42: 37106 | R42: 36923 | S42: 36950 | T42: 912 | U42: 1792 | V42: 1021 | W42: =U42-V42 -> 771
P43: 37113 | R43: 36952 | S43: 36952 | T43: 891.14285714285711 | U43: =2*(U$31-U$30)/31+U42 -> 1768.6451612903227 | V43: =2*(V$31-V$30)/31+V42 -> 1004.0322580645161
P44: 37120 | R44: 36959 | S44: 36959 | T44: 816.14285714285711 | U44: =7*(U$31-U$30)/31+U43 -> 1686.9032258064517 | V44: =7*(V$31-V$30)/31+V43 -> 944.64516129032256
P45: 37127 | R45: 36966 | S45: 36966 | T45: 793.14285714285711 | U45: =7*(U$31-U$30)/31+U44 -> 1605.1612903225807 | V45: =7*(V$31-V$30)/31+V44 -> 885.25806451612902
P46: 37134 | R46: 36973 | S46: 36973 | T46: 781.14285714285711 | U46: =7*(U$31-U$30)/31+U45 -> 1523.4193548387098 | V46: =7*(V$31-V$30)/31+V45 -> 825.87096774193549
P47: 37141 | R47: 36980 | S47: 36980 | T47: 732.14285714285711 | U47: =7*(U$31-U$30)/31+U46 -> 1441.6774193548388 | V47: =7*(V$31-V$30)/31+V46 -> 766.48387096774195
P48: 37148 | R48: 36981 | S48: 36981 | T48: 734.14285714285711 | U48: =1*(U$31-U$30)/31+U47 -> 1430 | V48: =1*(V$31-V$30)/31+V47 -> 758
P49: 37155 | R49: 36987 | S49: 36987 | T49: 746.14285714285711 | U49: =6*(U$32-U$31)/30+U48 -> 1446.8 | V49: =6*(V$32-V$31)/30+V48 -> 777.2
P50: 37162 | R50: 36994 | S50: 36994 | T50: 810.14285714285711 | U50: =7*(U$32-U$31)/30+U49 -> 1466.4 | V50: =7*(V$32-V$31)/30+V49 -> 799.6
P51: 37164 | R51: 37001 | S51: 37001 | T51: 853.14285714285711 | U51: =7*(U$32-U$31)/30+U50 -> 1486 | V51: =7*(V$32-V$31)/30+V50 -> 822
P52: 37169 | R52: 37008 | S52: 37008 | T52: 955 | U52: =7*(U$32-U$31)/30+U51 -> 1505.6 | V52: =7*(V$32-V$31)/30+V51 -> 844.4
P53: 37176 | R53: 37015 | S53: 37015 | T53: 1063 | U53: =3*(U$32-U$31)/30+4*(U$33-U$32)/31+U52 -> 1556.9677419354834 | V53: =3*(V$32-V$31)/30+4*(V$33-V$32)/31+V52 -> 893.61290322580646
P54: 37183 | R54: 37022 | S54: 37022 | T54: 1169 | U54: =7*(U$33-U$32)/31+U53 -> 1632.1612903225803 | V54: =7*(V$33-V$32)/31+V53 -> 962.9354838709678
P55: 37190 | R55: 37029 | S55: 37029 | T55: 1287 | U55: =7*(U$33-U$32)/31+U54 -> 1707.3548387096771 | V55: =7*(V$33-V$32)/31+V54 -> 1032.258064516129
P56: 37195 | R56: 37036 | S56: 37036
P57: 37197