A1: 2004 Product Supplied Data
A2: (Thousand Barrels per Day)
B3: Gasoline | D3: Distillate Fuel | F3: Jet Fuel | H3: Residual Fuel | J3: Other Products | L3: Total Products
B4: PSM | C4: PSA | D4: PSM | E4: PSA | F4: PSM | G4: PSA | H4: PSM | I4: PSA | J4: PSM | K4: PSA | L4: PSM | M4: PSA
A5: January | B5: 8680 | C5: 8705 | D5: 4350 | E5: 4334 | F5: 1507 | G5: 1505 | H5: 891 | I5: 980 | J5: =2622+2343 -> 4965 | K5: =2596+2360 -> 4956 | L5: 20393 | M5: 20479
A6: February | B6: 8743 | C6: 8838 | D6: 4268 | E6: 4232 | F6: 1651 | G6: 1672 | H6: 872 | I6: 988 | J6: =2522+2492 -> 5014 | K6: =2500+2642 -> 5142 | L6: 20549 | M6: 20872
A7: March | B7: 8922 | C7: 9024 | D7: 4126 | E7: 4152 | F7: 1560 | G7: 1560 | H7: 786 | I7: 882 | J7: =2033+2734 -> 4767 | K7: =2039+2795 -> 4834 | L7: 20161 | M7: 20453
A8: April | B8: 9067 | C8: 9126 | D8: 4121 | E8: 4145 | F8: 1574 | G8: 1571 | H8: 797 | I8: 829 | J8: =2065+2584 -> 4649 | K8: =2045+2829 -> 4874 | L8: 20207 | M8: 20545
A9: May | B9: 9178 | C9: 9179 | D9: 3854 | E9: 3840 | F9: 1574 | G9: 1596 | H9: 711 | I9: 777 | J9: =2039+2853 -> 4892 | K9: =1876+3045 -> 4921 | L9: 20209 | M9: 20313
A10: June | B10: 9237 | C10: 9322 | D10: 3860 | E10: 3888 | F10: 1647 | G10: 1669 | H10: 702 | I10: 824 | J10: =1771+3116 -> 4887 | K10: =1877+3200 -> 5077 | L10: 20333 | M10: 20780
A11: July | B11: 9243 | C11: 9357 | D11: 3850 | E11: 3827 | F11: 1651 | G11: 1658 | H11: 867 | I11: 901 | J11: =1916+3074 -> 4990 | K11: =1912+3225 -> 5137 | L11: 20601 | M11: 20880
A12: August | B12: 9244 | C12: 9327 | D12: 3878 | E12: 3887 | F12: 1704 | G12: 1730 | H12: 672 | I12: 778 | J12: =1970+3265 -> 5235 | K12: =1984+3322 -> 5306 | L12: 20732 | M12: 21028
A13: September | B13: 9030 | C13: 9015 | D13: 4059 | E13: 4065 | F13: 1577 | G13: 1611 | H13: 766 | I13: 784 | J13: =1937+3041 -> 4978 | K13: =1942+3111 -> 5053 | L13: 20411 | M13: 20529
A14: October | B14: 9103 | C14: 9097 | D14: 4113 | E14: 4104 | F14: 1630 | G14: 1641 | H14: 852 | I14: 858 | J14: =2190+2855 -> 5045 | K14: =2207+2954 -> 5161 | L14: 20743 | M14: 20861
A15: November | B15: 9070 | C15: 9055 | D15: 4053 | E15: 4058 | F15: 1684 | G15: 1704 | H15: 856 | I15: 861 | J15: =2234+2884 -> 5118 | K15: =2226+2901 -> 5127 | L15: 20782 | M15: 20805
A16: December | B16: 9219 | C16: 9206 | D16: 4180 | E16: 4176 | F16: 1647 | G16: 1645 | H16: 878 | I16: 918 | J16: =2393+2764 -> 5157 | K16: =2394+2891 -> 5285 | L16: 21080 | M16: 21229
A17: PSM: As published each month in the Petroleum Supply Monthly.
A18: PSA: As published in the Petroleum Supply Annual, Volume 2.
A19: Source: Energy Information Administration